platform,video_id,video_url,video_title,comment_id,author,text,time,votes,heart,fetched_utc,text_clean,sentimen_rule
youtube,2BIwPUhZPS4,https://www.youtube.com/watch?v=2BIwPUhZPS4,"“SEMOGA BUR*NGMU GA BERDIRI LAGI!"" SUMPAH SEORANG ISTRI YG TERDZOLIMI !",UgyuYVGRECpDIWcIeEl4AaABAg,@hjhapsah7227,Seorang suami yg pernah selingkuh pasti hidupnya Morat marit apalg d doakan oleh istri yg terlalu sakit persis mba sama yg saya alami saya juga pernah d selingkungi oleh suami sendiri sekrng saya sudah memutuskan untuk bercerai karena dia pinter untuk berbohong d hadapan istri intinya d mengguna2 saya mungkin Allah memberikan petunjuk untuk saya akhirnya ketahuan juga dan sempat saya mengucapkan hidup kamu ga akan bahagia dan burung kamu pasti ga akan berdiri LG dan hidup kamu Morat marit,2 bulan yang lalu,0,False,2025-12-20T09:28:58.544864+00:00,seorang suami yg pernah selingkuh pasti hidupnya morat marit apalg d doakan oleh istri yg terlalu sakit persis mba sama yg saya alami saya juga pernah d selingkungi oleh suami sendiri sekrng saya sudah memutuskan untuk bercerai karena dia pinter untuk berbohong d hadapan istri intinya d mengguna2 saya mungkin allah memberikan petunjuk untuk saya akhirnya ketahuan juga dan sempat saya mengucapkan hidup kamu ga akan bahagia dan burung kamu pasti ga akan berdiri lg dan hidup kamu morat marit,negatif
youtube,2BIwPUhZPS4,https://www.youtube.com/watch?v=2BIwPUhZPS4,"“SEMOGA BUR*NGMU GA BERDIRI LAGI!"" SUMPAH SEORANG ISTRI YG TERDZOLIMI !",Ugyb_Nk8HmNQLsCmVXl4AaABAg,@sriyudaningsih-v7q,Mbak nya cantik pinter...salut ngikuti curhatmu...smoga si PELAKOR bs sadar & th diri.,2 bulan yang lalu,0,False,2025-12-20T09:28:58.856957+00:00,mbak nya cantik pinter salut ngikuti curhatmu smoga si pelakor bs sadar th diri,negatif
youtube,2BIwPUhZPS4,https://www.youtube.com/watch?v=2BIwPUhZPS4,"“SEMOGA BUR*NGMU GA BERDIRI LAGI!"" SUMPAH SEORANG ISTRI YG TERDZOLIMI !",UgxD0vIKOTSKcOyj3A14AaABAg,@sriyudaningsih-v7q,"Luar biasa mbk ini... pemaaf, baik hati, sabar, ... semoga kelak mendapatkan pengganti yg lebih baik. Mantan suami kyk gt lbh baik dilepas sj...tukang selingkuh g bakalan bs sembuh.",2 bulan yang lalu,0,False,2025-12-20T09:28:59.127328+00:00,luar biasa mbk ini pemaaf baik hati sabar semoga kelak mendapatkan pengganti yg lebih baik mantan suami kyk gt lbh baik dilepas sj tukang selingkuh g bakalan bs sembuh,negatif
youtube,2BIwPUhZPS4,https://www.youtube.com/watch?v=2BIwPUhZPS4,"“SEMOGA BUR*NGMU GA BERDIRI LAGI!"" SUMPAH SEORANG ISTRI YG TERDZOLIMI !",UgzD8bNzzoPUfG4xIvR4AaABAg,@SISKADempi,"Suami sy d selingkuhin d Samarinda jaga,suami kerja PT kayu produk




Sama seperti sy juga kak,suami ku,berselingkuh sampai punya anak 2 sampai sekarang masih Samarinda",2 bulan yang lalu,0,False,2025-12-20T09:28:59.404682+00:00,suami sy d selingkuhin d samarinda jaga suami kerja pt kayu produk sama seperti sy juga kak suami ku berselingkuh sampai punya anak 2 sampai sekarang masih samarinda,negatif
youtube,2BIwPUhZPS4,https://www.youtube.com/watch?v=2BIwPUhZPS4,"“SEMOGA BUR*NGMU GA BERDIRI LAGI!"" SUMPAH SEORANG ISTRI YG TERDZOLIMI !",UgwcTr98ngH9IQltCTx4AaABAg,@DikmasKafa,"Berhati²lah para suami yg selingkuh doa istri yg tulus sangat mustajab,karna Allah murka pada suami yg menyakiti istrinya... sadarlah2 para selingkuh sebelum terlambat...sabar ya mbk",2 bulan yang lalu,0,False,2025-12-20T09:29:00.122079+00:00,berhati lah para suami yg selingkuh doa istri yg tulus sangat mustajab karna allah murka pada suami yg menyakiti istrinya sadarlah2 para selingkuh sebelum terlambat sabar ya mbk,negatif
youtube,2BIwPUhZPS4,https://www.youtube.com/watch?v=2BIwPUhZPS4,"“SEMOGA BUR*NGMU GA BERDIRI LAGI!"" SUMPAH SEORANG ISTRI YG TERDZOLIMI !",UgyLvVe2VEi5UOUk0GF4AaABAg,@ChelseaAleandra-q2o9j,😅 akupun bgtu mimpiin trus pasang selingkuh.... ternyata itu pertanda 😊,2 bulan yang lalu,0,False,2025-12-20T09:29:00.433686+00:00,akupun bgtu mimpiin trus pasang selingkuh ternyata itu pertanda,negatif
youtube,2BIwPUhZPS4,https://www.youtube.com/watch?v=2BIwPUhZPS4,"“SEMOGA BUR*NGMU GA BERDIRI LAGI!"" SUMPAH SEORANG ISTRI YG TERDZOLIMI !",UgzzOgVuzitNTREERMt4AaABAg,@Clipxclap,Ingat ya klo udh sekali selingkuh pasti selingkuh lagi jdi jgn pernh mau,2 bulan yang lalu,0,False,2025-12-20T09:29:00.749361+00:00,ingat ya klo udh sekali selingkuh pasti selingkuh lagi jdi jgn pernh mau,negatif
youtube,2BIwPUhZPS4,https://www.youtube.com/watch?v=2BIwPUhZPS4,"“SEMOGA BUR*NGMU GA BERDIRI LAGI!"" SUMPAH SEORANG ISTRI YG TERDZOLIMI !",UgykOIt7HL8y77Rs2yR4AaABAg,@acengPs,"Nmnya jg penyakit selingkuh itu GK dh obat ny,,skli slingkuh bkln ttp selingkuh aplgi di maaf kn mkin²di ulng2 trus",2 bulan yang lalu,0,False,2025-12-20T09:29:01.062230+00:00,nmnya jg penyakit selingkuh itu gk dh obat ny skli slingkuh bkln ttp selingkuh aplgi di maaf kn mkin di ulng2 trus,negatif
youtube,2BIwPUhZPS4,https://www.youtube.com/watch?v=2BIwPUhZPS4,"“SEMOGA BUR*NGMU GA BERDIRI LAGI!"" SUMPAH SEORANG ISTRI YG TERDZOLIMI !",UgzFtDnslSryErOvF2R4AaABAg,@dhiniant,"parah bgt bang, istri nya udh cantik bgini kok masih di selingkuhin yah. dasar emng laki gk bersyukur itu. bahkan klo itu suaminya dikasih monyet dibedakin juga diembat keknya wkwkwk",2 bulan yang lalu,0,False,2025-12-20T09:29:01.355923+00:00,parah bgt bang istri nya udh cantik bgini kok masih di selingkuhin yah dasar emng laki gk bersyukur itu bahkan klo itu suaminya dikasih monyet dibedakin juga diembat keknya wkwkwk,negatif
youtube,2BIwPUhZPS4,https://www.youtube.com/watch?v=2BIwPUhZPS4,"“SEMOGA BUR*NGMU GA BERDIRI LAGI!"" SUMPAH SEORANG ISTRI YG TERDZOLIMI !",Ugzb2rAJgrbO85XEDIV4AaABAg,@syarifal-mahdi5683,"Cantik juga diselingkuhi. Terlebih bagi yg kurang cantiknya. Ini bagi laki-laki yg tdk beriman. Jadi kriteria suami terbaik ukur dari ""Ketaatannya"". Itu yg paling utama. Gagah, kaya dan besar ukurannya itu hanya bonus.",2 bulan yang lalu,0,False,2025-12-20T09:29:02.240700+00:00,cantik juga diselingkuhi terlebih bagi yg kurang cantiknya ini bagi laki laki yg tdk beriman jadi kriteria suami terbaik ukur dari ketaatannya itu yg paling utama gagah kaya dan besar ukurannya itu hanya bonus,negatif
youtube,2BIwPUhZPS4,https://www.youtube.com/watch?v=2BIwPUhZPS4,"“SEMOGA BUR*NGMU GA BERDIRI LAGI!"" SUMPAH SEORANG ISTRI YG TERDZOLIMI !",UgxRxID_iCGbJH4pAvx4AaABAg,@syarifal-mahdi5683,"Cantik juga diselingkuhi. Terlebih bagi yg kurang cantiknya. Ini bagi laki-laki yg tdk beriman. Jadi kriteria suami terbaik ukur dari ""Ketaatannya"". Itu yg paling utama. Gagah, kaya dan besar ukurannya itu hanya bonus.",2 bulan yang lalu,0,False,2025-12-20T09:29:02.516457+00:00,cantik juga diselingkuhi terlebih bagi yg kurang cantiknya ini bagi laki laki yg tdk beriman jadi kriteria suami terbaik ukur dari ketaatannya itu yg paling utama gagah kaya dan besar ukurannya itu hanya bonus,negatif
youtube,2BIwPUhZPS4,https://www.youtube.com/watch?v=2BIwPUhZPS4,"“SEMOGA BUR*NGMU GA BERDIRI LAGI!"" SUMPAH SEORANG ISTRI YG TERDZOLIMI !",UgyXG1AIGPt61_9q8rV4AaABAg,@aprilianapermatasari9027,Karna tukang selingkuh itu penyakit,2 bulan yang lalu,0,False,2025-12-20T09:29:02.824420+00:00,karna tukang selingkuh itu penyakit,negatif
youtube,2BIwPUhZPS4,https://www.youtube.com/watch?v=2BIwPUhZPS4,"“SEMOGA BUR*NGMU GA BERDIRI LAGI!"" SUMPAH SEORANG ISTRI YG TERDZOLIMI !",Ugz9uOjcbeK_SkbJXPB4AaABAg,@arrysulasto702,"Salut..sm mbak ini, tetep setia, bbrp x suami selingkuh msh diberi maaf, memang klo sdh tabiat suami spt itu sulit diperbaiki, akhirnya kesabaran & waktu yg menjawabnya, semoga kemudian hari bs mendapatkan suami yg jauh lbh baik, amiin yra ❤",2 bulan yang lalu,0,False,2025-12-20T09:29:03.563192+00:00,salut sm mbak ini tetep setia bbrp x suami selingkuh msh diberi maaf memang klo sdh tabiat suami spt itu sulit diperbaiki akhirnya kesabaran waktu yg menjawabnya semoga kemudian hari bs mendapatkan suami yg jauh lbh baik amiin yra,negatif
youtube,2BIwPUhZPS4,https://www.youtube.com/watch?v=2BIwPUhZPS4,"“SEMOGA BUR*NGMU GA BERDIRI LAGI!"" SUMPAH SEORANG ISTRI YG TERDZOLIMI !",UgwIvHOA-uhmS-DrblN4AaABAg,@isaoktavia8618,Udah candu selingkuh,2 bulan yang lalu,0,False,2025-12-20T09:29:03.861892+00:00,udah candu selingkuh,negatif
youtube,2BIwPUhZPS4,https://www.youtube.com/watch?v=2BIwPUhZPS4,"“SEMOGA BUR*NGMU GA BERDIRI LAGI!"" SUMPAH SEORANG ISTRI YG TERDZOLIMI !",UgxXQLpb08xoY-p-Fu14AaABAg,@babarara2695,Semakin tinggi iq seseorang Maka semakin rendah kemungkinan berselingkuh. Jadi kalau cowo begini iq nya rendah a.k.a bodoh total,2 bulan yang lalu,0,False,2025-12-20T09:29:04.129366+00:00,semakin tinggi iq seseorang maka semakin rendah kemungkinan berselingkuh jadi kalau cowo begini iq nya rendah a k a bodoh total,negatif
youtube,2BIwPUhZPS4,https://www.youtube.com/watch?v=2BIwPUhZPS4,"“SEMOGA BUR*NGMU GA BERDIRI LAGI!"" SUMPAH SEORANG ISTRI YG TERDZOLIMI !",UgzvX-KhUi6khalQEQF4AaABAg,@SusantiEli-k8q,Pelakornya jellekkk cantikan istri sah nya 😅😅,2 bulan yang lalu,0,False,2025-12-20T09:29:04.404386+00:00,pelakornya jellekkk cantikan istri sah nya,negatif
youtube,2BIwPUhZPS4,https://www.youtube.com/watch?v=2BIwPUhZPS4,"“SEMOGA BUR*NGMU GA BERDIRI LAGI!"" SUMPAH SEORANG ISTRI YG TERDZOLIMI !",UgyNju2GLhgrkMJ9sjx4AaABAg,@ludfyunto,penyakit selingkuh gak bisa di obati,2 bulan yang lalu,0,False,2025-12-20T09:29:04.662676+00:00,penyakit selingkuh gak bisa di obati,negatif
youtube,2BIwPUhZPS4,https://www.youtube.com/watch?v=2BIwPUhZPS4,"“SEMOGA BUR*NGMU GA BERDIRI LAGI!"" SUMPAH SEORANG ISTRI YG TERDZOLIMI !",UgxDYT5WDF4rH-0_hsJ4AaABAg,@depikarahma7308,Pernah di iming-imingi jadi pelakor. Padahal dia udh anak 4.tapi aku kekeh ga akan terjadi di hidup ku merebut suami orang. Sakitnya luar biasa pasti istrinya. Memang kelakuan laki2 itu jahat.,2 bulan yang lalu,0,False,2025-12-20T09:29:04.946391+00:00,pernah di iming imingi jadi pelakor padahal dia udh anak 4 tapi aku kekeh ga akan terjadi di hidup ku merebut suami orang sakitnya luar biasa pasti istrinya memang kelakuan laki2 itu jahat,negatif
youtube,2BIwPUhZPS4,https://www.youtube.com/watch?v=2BIwPUhZPS4,"“SEMOGA BUR*NGMU GA BERDIRI LAGI!"" SUMPAH SEORANG ISTRI YG TERDZOLIMI !",Ugy1I4cn-vCyej1ERwx4AaABAg,@AliyaAja-l5z,"Cerita nya sama kaya saya, kalau saya setiap suami selingkuh pasti dtg ke mimpi",2 bulan yang lalu,0,False,2025-12-20T09:29:05.641971+00:00,cerita nya sama kaya saya kalau saya setiap suami selingkuh pasti dtg ke mimpi,negatif
youtube,2BIwPUhZPS4,https://www.youtube.com/watch?v=2BIwPUhZPS4,"“SEMOGA BUR*NGMU GA BERDIRI LAGI!"" SUMPAH SEORANG ISTRI YG TERDZOLIMI !",UgyQyB61eZkEBZN8wvZ4AaABAg,@syaifulrbc6163,Suami selingkuh sebagai istri yang baik mending suami di nikahkan,2 bulan yang lalu,0,False,2025-12-20T09:29:05.916998+00:00,suami selingkuh sebagai istri yang baik mending suami di nikahkan,negatif
youtube,2BIwPUhZPS4,https://www.youtube.com/watch?v=2BIwPUhZPS4,"“SEMOGA BUR*NGMU GA BERDIRI LAGI!"" SUMPAH SEORANG ISTRI YG TERDZOLIMI !",UgwvycbnVpAGG-HluRd4AaABAg,@Violettacakradinata,"Klu pacaran udh ketauan selingkuh hrsnya ngak ush d terusin smp ke pernikahan fenny.......yg namanya semingkuh itu PENYAKIT tibatnya ntar klu udh mau MATI!!!

Buat pelajaran bagi kalian yg pny pacar senang selingkuh, jng prh mau di nikahi sm laki2 macem gini!!! Drpd nantinya kalian menikah trus kejadian lagi hancurrr RT kalian yg adaa

Nahhh klu udh bgtu tolong dr pihak perusahaan pecat nih laki2 kyk bgni biar jd sampah ngak berguna sekalian!!",2 bulan yang lalu (diedit),0,False,2025-12-20T09:29:06.186503+00:00,klu pacaran udh ketauan selingkuh hrsnya ngak ush d terusin smp ke pernikahan fenny yg namanya semingkuh itu penyakit tibatnya ntar klu udh mau mati buat pelajaran bagi kalian yg pny pacar senang selingkuh jng prh mau di nikahi sm laki2 macem gini drpd nantinya kalian menikah trus kejadian lagi hancurrr rt kalian yg adaa nahhh klu udh bgtu tolong dr pihak perusahaan pecat nih laki2 kyk bgni biar jd sampah ngak berguna sekalian,negatif
youtube,2BIwPUhZPS4,https://www.youtube.com/watch?v=2BIwPUhZPS4,"“SEMOGA BUR*NGMU GA BERDIRI LAGI!"" SUMPAH SEORANG ISTRI YG TERDZOLIMI !",UgwBPVLQK51SDqnjYsJ4AaABAg,@mulkidi-f1b,"Bang Denny, sebaiknya di tampilkan 2 pihak yg bertikai, apa bener semuanya adalah kesalahan suami, siapa tau istri juga melakukan kesalahan shg suami selingkuh, jika 1 pihak yg di tanyai akan kurang berimbang",2 bulan yang lalu,0,False,2025-12-20T09:29:06.502167+00:00,bang denny sebaiknya di tampilkan 2 pihak yg bertikai apa bener semuanya adalah kesalahan suami siapa tau istri juga melakukan kesalahan shg suami selingkuh jika 1 pihak yg di tanyai akan kurang berimbang,negatif
youtube,2BIwPUhZPS4,https://www.youtube.com/watch?v=2BIwPUhZPS4,"“SEMOGA BUR*NGMU GA BERDIRI LAGI!"" SUMPAH SEORANG ISTRI YG TERDZOLIMI !",Ugy7pGFt0YE13jMAtTt4AaABAg,@ooreedo,tolol cewe kek gini diselingkuhi😹,2 bulan yang lalu,0,False,2025-12-20T09:29:07.722164+00:00,tolol cewe kek gini diselingkuhi,negatif
youtube,2BIwPUhZPS4,https://www.youtube.com/watch?v=2BIwPUhZPS4,"“SEMOGA BUR*NGMU GA BERDIRI LAGI!"" SUMPAH SEORANG ISTRI YG TERDZOLIMI !",UgzNbhqNZJTHWw6AdYR4AaABAg,@NovitaWulanSari-t8v,Selingkuh itu penyakit yang ga akan pernah sembuh,2 bulan yang lalu,0,False,2025-12-20T09:29:08.003351+00:00,selingkuh itu penyakit yang ga akan pernah sembuh,negatif
youtube,2BIwPUhZPS4,https://www.youtube.com/watch?v=2BIwPUhZPS4,"“SEMOGA BUR*NGMU GA BERDIRI LAGI!"" SUMPAH SEORANG ISTRI YG TERDZOLIMI !",UgxHMdrlNM_O2apoz_F4AaABAg,@essijbi8111,"Punya istri baek malah selingkuh,,

Nanti suatu saat penyeslan itu tiba",2 bulan yang lalu,0,False,2025-12-20T09:29:08.282002+00:00,punya istri baek malah selingkuh nanti suatu saat penyeslan itu tiba,negatif
youtube,2BIwPUhZPS4,https://www.youtube.com/watch?v=2BIwPUhZPS4,"“SEMOGA BUR*NGMU GA BERDIRI LAGI!"" SUMPAH SEORANG ISTRI YG TERDZOLIMI !",UgzfS4jwVsl1s1P2DPp4AaABAg,@senisenbas1061,"Jadi pelajaran takaran cinta kepada manusia itu jangan 100%, karena disaat kecewa sakit nya pasti seperti Kaka ini,  memaafkan berulang kali untuk sesuatu yang harus nya dari awal dilepas bukan dipelihara 🙏, selingkuh itu bukan untuk di toleransi apalagi dari sebelum menikah harus nya segera dibuang jangan malah kekeuh dijadikan suami, maaf ya ka aku agak Gedeg klo perempuan yang kekeuh mertahanin laki laki tukang selingkuh 😢, pada akhirnya sakit juga kan",2 bulan yang lalu,0,False,2025-12-20T09:29:08.613010+00:00,jadi pelajaran takaran cinta kepada manusia itu jangan 100 karena disaat kecewa sakit nya pasti seperti kaka ini memaafkan berulang kali untuk sesuatu yang harus nya dari awal dilepas bukan dipelihara selingkuh itu bukan untuk di toleransi apalagi dari sebelum menikah harus nya segera dibuang jangan malah kekeuh dijadikan suami maaf ya ka aku agak gedeg klo perempuan yang kekeuh mertahanin laki laki tukang selingkuh pada akhirnya sakit juga kan,negatif
youtube,2BIwPUhZPS4,https://www.youtube.com/watch?v=2BIwPUhZPS4,"“SEMOGA BUR*NGMU GA BERDIRI LAGI!"" SUMPAH SEORANG ISTRI YG TERDZOLIMI !",UgwzZSZT5-aiv397fPJ4AaABAg,@Ihromi-i1u,"Kak aku pernah digituin juga, selama nonton podcast tangan ku ikut Tremor dan dingin juga, trauma nya perselingkuhan memang luar biasa ya 😢",2 bulan yang lalu,0,False,2025-12-20T09:29:09.348313+00:00,kak aku pernah digituin juga selama nonton podcast tangan ku ikut tremor dan dingin juga trauma nya perselingkuhan memang luar biasa ya,negatif
youtube,2BIwPUhZPS4,https://www.youtube.com/watch?v=2BIwPUhZPS4,"“SEMOGA BUR*NGMU GA BERDIRI LAGI!"" SUMPAH SEORANG ISTRI YG TERDZOLIMI !",UgyXsFIzUeIUvE5idPR4AaABAg,@PutraSitorus-i6k,Selingkuh itu GK akan sembuhhh gaisss,2 bulan yang lalu,0,False,2025-12-20T09:29:09.627297+00:00,selingkuh itu gk akan sembuhhh gaisss,negatif
youtube,2BIwPUhZPS4,https://www.youtube.com/watch?v=2BIwPUhZPS4,"“SEMOGA BUR*NGMU GA BERDIRI LAGI!"" SUMPAH SEORANG ISTRI YG TERDZOLIMI !",UgxJOEcpQSISLMSgsd94AaABAg,@ZulhamdiKu,"Sudah dapat istri cantik pintar masih saja selingkuh,,sabar Feni mudah2an kamu dapat suami yg baik,setia dan bertanggung jawab.",2 bulan yang lalu,0,False,2025-12-20T09:29:09.898608+00:00,sudah dapat istri cantik pintar masih saja selingkuh sabar feni mudah2an kamu dapat suami yg baik setia dan bertanggung jawab,negatif
youtube,2BIwPUhZPS4,https://www.youtube.com/watch?v=2BIwPUhZPS4,"“SEMOGA BUR*NGMU GA BERDIRI LAGI!"" SUMPAH SEORANG ISTRI YG TERDZOLIMI !",UgyB8f_RoATmMQ_WaFJ4AaABAg,@Putri29569,Emang yh kalau tabiatnya selingkuh gk bakalan sembuh,2 bulan yang lalu,0,False,2025-12-20T09:29:10.178085+00:00,emang yh kalau tabiatnya selingkuh gk bakalan sembuh,negatif
youtube,2BIwPUhZPS4,https://www.youtube.com/watch?v=2BIwPUhZPS4,"“SEMOGA BUR*NGMU GA BERDIRI LAGI!"" SUMPAH SEORANG ISTRI YG TERDZOLIMI !",Ugz40SLIojwUr8MyQaN4AaABAg,@ririarianti0411,"sebagai korban perselingkuhan 9 tahun lalu, semua yang jadi do'a mba feni adalah do'a saya juga dulu (bahkan sampai hari ini).
9 tahun berlalu, dan saya pun saat ini sudah menikah lagi, tapi rasa sakit dan trauma karena diselingkuhi itu sangat sulit dilupakan. memang betul, bahkan sampai matipun mungkin rasa sakit ini masih akan tetap ada.
karena pengkhianatan tidak pernah ada obatnya, sekalipun kalian menemukan pengganti mantan suami kalian, yang lebih tulus cinta dan sayang pada kalian.
aku saksi hidup korban perselingkuhan, rasa sakitnya akan selalu membekas.
dan untuk para pezina, ingat ya! TIADA DOSA BEBAS TANPA BALAS ‼️‼️‼️",2 bulan yang lalu (diedit),0,False,2025-12-20T09:29:10.456080+00:00,sebagai korban perselingkuhan 9 tahun lalu semua yang jadi do a mba feni adalah do a saya juga dulu bahkan sampai hari ini 9 tahun berlalu dan saya pun saat ini sudah menikah lagi tapi rasa sakit dan trauma karena diselingkuhi itu sangat sulit dilupakan memang betul bahkan sampai matipun mungkin rasa sakit ini masih akan tetap ada karena pengkhianatan tidak pernah ada obatnya sekalipun kalian menemukan pengganti mantan suami kalian yang lebih tulus cinta dan sayang pada kalian aku saksi hidup korban perselingkuhan rasa sakitnya akan selalu membekas dan untuk para pezina ingat ya tiada dosa bebas tanpa balas,negatif
youtube,2BIwPUhZPS4,https://www.youtube.com/watch?v=2BIwPUhZPS4,"“SEMOGA BUR*NGMU GA BERDIRI LAGI!"" SUMPAH SEORANG ISTRI YG TERDZOLIMI !",UgzND7G7BOXHa38GLjN4AaABAg,@NejatGanteng,"Pengen rasanya punya istri seperti mb ini,.. Kasih sayang dn cintanya sangat tulus ke suaminya melebihi dirinya.. Namun suaminya menghiantinya.. Sy sebagai laki2 yg pernah di selingkuhin,, merasa ikut sedih.. Karena sy sangat sayang dn cinta ke istriku.. Dia adalah pacar pertama,, istri pertama dan pasangan yg sy anggap jujur,, sabar dn sy yakin tdk akan selingkuh.. Tp ternyata sy salah menilai nya.. Astaghfirullah.. Astaghfirullah.. Astaghfirullah.. Ampuni Hamba-Mu ini yaa Rabb.. Dan Ampuni seluruh Hamba2-Mu Yaa Rabb Yg mempunyai Kesalahan Kepada-Mu dan Hamba2-Mu yg Terdzolimi dan Hamba2-Mu yg Dzolim.. Aamiin aamiin aamiin Yaa Allaah Yaa Rabb.. 🤲🤲🤲",2 bulan yang lalu,0,False,2025-12-20T09:29:11.779055+00:00,pengen rasanya punya istri seperti mb ini kasih sayang dn cintanya sangat tulus ke suaminya melebihi dirinya namun suaminya menghiantinya sy sebagai laki2 yg pernah di selingkuhin merasa ikut sedih karena sy sangat sayang dn cinta ke istriku dia adalah pacar pertama istri pertama dan pasangan yg sy anggap jujur sabar dn sy yakin tdk akan selingkuh tp ternyata sy salah menilai nya astaghfirullah astaghfirullah astaghfirullah ampuni hamba mu ini yaa rabb dan ampuni seluruh hamba2 mu yaa rabb yg mempunyai kesalahan kepada mu dan hamba2 mu yg terdzolimi dan hamba2 mu yg dzolim aamiin aamiin aamiin yaa allaah yaa rabb,negatif
youtube,2BIwPUhZPS4,https://www.youtube.com/watch?v=2BIwPUhZPS4,"“SEMOGA BUR*NGMU GA BERDIRI LAGI!"" SUMPAH SEORANG ISTRI YG TERDZOLIMI !",UgwnvUxunr04rcnkdPp4AaABAg,@deviwahyu1177,"Maaf bukan mau menjudge mbaknya ya, tapi sebenarnya kalau awal sebelum nikah ketahuan selingkuh meskipun dalihnya cuma nongkrong baiknya jangan dilanjut, selingkuh itu nggak bisa disembuhkan, dan mungkin sebenarnya itu udah jadi pertanda kalau cowoknya nggak baik untuk mbaknya",2 bulan yang lalu,0,False,2025-12-20T09:29:12.056540+00:00,maaf bukan mau menjudge mbaknya ya tapi sebenarnya kalau awal sebelum nikah ketahuan selingkuh meskipun dalihnya cuma nongkrong baiknya jangan dilanjut selingkuh itu nggak bisa disembuhkan dan mungkin sebenarnya itu udah jadi pertanda kalau cowoknya nggak baik untuk mbaknya,negatif
youtube,2BIwPUhZPS4,https://www.youtube.com/watch?v=2BIwPUhZPS4,"“SEMOGA BUR*NGMU GA BERDIRI LAGI!"" SUMPAH SEORANG ISTRI YG TERDZOLIMI !",Ugx0aFUS-grtmX5UXUR4AaABAg,@ardiantowega2658,Selingkuh itu penyakit ga akan pernah berubah sampe kapanpun,2 bulan yang lalu,0,False,2025-12-20T09:29:12.368251+00:00,selingkuh itu penyakit ga akan pernah berubah sampe kapanpun,negatif
youtube,2BIwPUhZPS4,https://www.youtube.com/watch?v=2BIwPUhZPS4,"“SEMOGA BUR*NGMU GA BERDIRI LAGI!"" SUMPAH SEORANG ISTRI YG TERDZOLIMI !",UgzcluoTRQXPkU79wzt4AaABAg,@TiaNingrum-q6m,"Emng dasarnya dri pacaran sdh selingkuh ngga bsa smbuh  ,dan bgi perempuan dri awal sdh diselingkuhi ngga bkal bsa tdur nyenyak 
Edit aku aminkan do'a mu",2 bulan yang lalu (diedit),0,False,2025-12-20T09:29:13.085671+00:00,emng dasarnya dri pacaran sdh selingkuh ngga bsa smbuh dan bgi perempuan dri awal sdh diselingkuhi ngga bkal bsa tdur nyenyak edit aku aminkan do a mu,negatif
youtube,2BIwPUhZPS4,https://www.youtube.com/watch?v=2BIwPUhZPS4,"“SEMOGA BUR*NGMU GA BERDIRI LAGI!"" SUMPAH SEORANG ISTRI YG TERDZOLIMI !",UgyPob0TuPBGPamYgMR4AaABAg,@nggogocar,Padahal istriya sendiri sudah cantik  kok di selingkuhin badanya istri juga bagus llangsing,2 bulan yang lalu,0,False,2025-12-20T09:29:13.402004+00:00,padahal istriya sendiri sudah cantik kok di selingkuhin badanya istri juga bagus llangsing,negatif
youtube,2BIwPUhZPS4,https://www.youtube.com/watch?v=2BIwPUhZPS4,"“SEMOGA BUR*NGMU GA BERDIRI LAGI!"" SUMPAH SEORANG ISTRI YG TERDZOLIMI !",Ugz4pe-_VRHU8EdRPYN4AaABAg,@LestariEtik-w5f,Selingkuh itu kyk sifat susah hilang kayak nya ea,2 bulan yang lalu,0,False,2025-12-20T09:29:14.127698+00:00,selingkuh itu kyk sifat susah hilang kayak nya ea,negatif
youtube,2BIwPUhZPS4,https://www.youtube.com/watch?v=2BIwPUhZPS4,"“SEMOGA BUR*NGMU GA BERDIRI LAGI!"" SUMPAH SEORANG ISTRI YG TERDZOLIMI !",Ugzwf0k1X6if1F-Z7yt4AaABAg,@OzzyAwakenz,"Di Indonesia selingkuh sudah jadi gaya hidup, mengerikan",2 bulan yang lalu,0,False,2025-12-20T09:29:14.415699+00:00,di indonesia selingkuh sudah jadi gaya hidup mengerikan,negatif
youtube,2BIwPUhZPS4,https://www.youtube.com/watch?v=2BIwPUhZPS4,"“SEMOGA BUR*NGMU GA BERDIRI LAGI!"" SUMPAH SEORANG ISTRI YG TERDZOLIMI !",UgzRJMZU8wKJbcFVZal4AaABAg,@HannySugiarti777,"Emang kalo cewek pake hati sulit melepaskan karena “sayang hubungan sudah 3tahun, saya maafkan” padahal tabiat laki nya ke bangke. Sekarang sudah sayaang dengan diri sendiri dan sudah pakai logika “ga ada kata sayang dengan hubungan” jadi dilepaskan. Biar aja pelakor sama mantannya dapet azab. Sehat2 teteh, kebahagiaan menanti mu.",2 bulan yang lalu,0,False,2025-12-20T09:29:14.691967+00:00,emang kalo cewek pake hati sulit melepaskan karena sayang hubungan sudah 3tahun saya maafkan padahal tabiat laki nya ke bangke sekarang sudah sayaang dengan diri sendiri dan sudah pakai logika ga ada kata sayang dengan hubungan jadi dilepaskan biar aja pelakor sama mantannya dapet azab sehat2 teteh kebahagiaan menanti mu,negatif
youtube,2BIwPUhZPS4,https://www.youtube.com/watch?v=2BIwPUhZPS4,"“SEMOGA BUR*NGMU GA BERDIRI LAGI!"" SUMPAH SEORANG ISTRI YG TERDZOLIMI !",Ugy6HM-ItFeVWVjRach4AaABAg,@laelazarwati7742,Astaghfirullahalaziiim...Doa seorang Bunda sangat makbul hati2 bagi suami yg selingkuh....😢😢😢,2 bulan yang lalu,51,False,2025-12-20T09:29:14.993679+00:00,astaghfirullahalaziiim doa seorang bunda sangat makbul hati2 bagi suami yg selingkuh,negatif
youtube,2BIwPUhZPS4,https://www.youtube.com/watch?v=2BIwPUhZPS4,"“SEMOGA BUR*NGMU GA BERDIRI LAGI!"" SUMPAH SEORANG ISTRI YG TERDZOLIMI !",UgyqwmYjho23EvXVa1l4AaABAg,@weihao-t2j,"Ya bgs seru critany, Itu pling pelakor yg Gk stuju ad podcast kyk in",2 bulan yang lalu,0,False,2025-12-20T09:29:15.276778+00:00,ya bgs seru critany itu pling pelakor yg gk stuju ad podcast kyk in,negatif
youtube,2BIwPUhZPS4,https://www.youtube.com/watch?v=2BIwPUhZPS4,"“SEMOGA BUR*NGMU GA BERDIRI LAGI!"" SUMPAH SEORANG ISTRI YG TERDZOLIMI !",Ugx3ysYFVlzFsEL934d4AaABAg,@kikylim5862,Kak penyakit selingkuh tak bs diobati pasti akan ngulang lg,2 bulan yang lalu,0,False,2025-12-20T09:29:15.582066+00:00,kak penyakit selingkuh tak bs diobati pasti akan ngulang lg,negatif
youtube,2BIwPUhZPS4,https://www.youtube.com/watch?v=2BIwPUhZPS4,"“SEMOGA BUR*NGMU GA BERDIRI LAGI!"" SUMPAH SEORANG ISTRI YG TERDZOLIMI !",Ugy5lP-8Gbd9DxAYP4F4AaABAg,@YusriyanaHaerani,"Istrinya cantik loh, masih heran kenapa selingkuhan masih lebih cantik istri sah",2 bulan yang lalu,0,False,2025-12-20T09:29:16.345481+00:00,istrinya cantik loh masih heran kenapa selingkuhan masih lebih cantik istri sah,negatif
youtube,2BIwPUhZPS4,https://www.youtube.com/watch?v=2BIwPUhZPS4,"“SEMOGA BUR*NGMU GA BERDIRI LAGI!"" SUMPAH SEORANG ISTRI YG TERDZOLIMI !",UgwWQlstqWVS_hj--Mp4AaABAg,@antosudarmonosudarmono7839,Cantik istrinya loh dari pada selingkuhan nya,2 bulan yang lalu,0,False,2025-12-20T09:29:16.612712+00:00,cantik istrinya loh dari pada selingkuhan nya,negatif
youtube,2BIwPUhZPS4,https://www.youtube.com/watch?v=2BIwPUhZPS4,"“SEMOGA BUR*NGMU GA BERDIRI LAGI!"" SUMPAH SEORANG ISTRI YG TERDZOLIMI !",Ugwj7cL1qCLdiB9LngB4AaABAg,@latifahrahmah5752,"Turut bersimpati dgn kak fenny, krna di selingkuhin memang sgt sakit dan membekas diingatan gk bisa dilupain, semoga kk mndpt kbhgiaan stlah ini❤",2 bulan yang lalu,0,False,2025-12-20T09:29:16.895200+00:00,turut bersimpati dgn kak fenny krna di selingkuhin memang sgt sakit dan membekas diingatan gk bisa dilupain semoga kk mndpt kbhgiaan stlah ini,negatif
