platform,video_id,video_url,video_title,comment_id,author,text,time,votes,heart,fetched_utc,text_clean,sentimen_rule
youtube,2BIwPUhZPS4,https://www.youtube.com/watch?v=2BIwPUhZPS4,"“SEMOGA BUR*NGMU GA BERDIRI LAGI!"" SUMPAH SEORANG ISTRI YG TERDZOLIMI !",UgzYuUFgMaVO2GbfJIF4AaABAg,@IdaMasruri,"Q juga heran sama laki tuh apa yg ada di pikiran Mereka, saya dl juga pernah di selingkuhi berkeli² bahkan mau udh tunangan aja masih aja ketahuan selingkuh bahkan kos bareng bodohnya saya kok ya saya lanjutkan nikah ternyata emang bermasalah hidupnya",2 bulan yang lalu,0,False,2025-12-20T09:29:51.022092+00:00,q juga heran sama laki tuh apa yg ada di pikiran mereka saya dl juga pernah di selingkuhi berkeli bahkan mau udh tunangan aja masih aja ketahuan selingkuh bahkan kos bareng bodohnya saya kok ya saya lanjutkan nikah ternyata emang bermasalah hidupnya,negatif
youtube,2BIwPUhZPS4,https://www.youtube.com/watch?v=2BIwPUhZPS4,"“SEMOGA BUR*NGMU GA BERDIRI LAGI!"" SUMPAH SEORANG ISTRI YG TERDZOLIMI !",UgzFiJSdUCTIHDwL94R4AaABAg,@fitriani0556,"Aku udh pernah ngalami JD aku puas jg udh ada yg nyampein kisah hdp ku dlu sama persis ,pesan q bwt para pelakor selamat ya kalian udah berhasil hancurin RT org dan merampas hak ank kami smoga kalian segera mendapatkan hidayah",2 bulan yang lalu,0,False,2025-12-20T09:29:51.762155+00:00,aku udh pernah ngalami jd aku puas jg udh ada yg nyampein kisah hdp ku dlu sama persis pesan q bwt para pelakor selamat ya kalian udah berhasil hancurin rt org dan merampas hak ank kami smoga kalian segera mendapatkan hidayah,negatif
youtube,2BIwPUhZPS4,https://www.youtube.com/watch?v=2BIwPUhZPS4,"“SEMOGA BUR*NGMU GA BERDIRI LAGI!"" SUMPAH SEORANG ISTRI YG TERDZOLIMI !",UgyiwjcHo5IRjTLWcl94AaABAg,@prayogapangestuk,Muka mbanya mirip mantanku. Tapi sifatnya mantanku sperti suami mbanya. Alhamdulillah di jauhkan orang seperti itu. SELINGKUH itu PENYAKIT,2 bulan yang lalu,0,False,2025-12-20T09:29:52.063541+00:00,muka mbanya mirip mantanku tapi sifatnya mantanku sperti suami mbanya alhamdulillah di jauhkan orang seperti itu selingkuh itu penyakit,negatif
youtube,2BIwPUhZPS4,https://www.youtube.com/watch?v=2BIwPUhZPS4,"“SEMOGA BUR*NGMU GA BERDIRI LAGI!"" SUMPAH SEORANG ISTRI YG TERDZOLIMI !",Ugwktklwrj4YypNJD3p4AaABAg,@Shintya_Rahmahdani,Gue bukan pelakor woy gue korban korbannye paham,2 bulan yang lalu,0,False,2025-12-20T09:29:52.362513+00:00,gue bukan pelakor woy gue korban korbannye paham,negatif
youtube,2BIwPUhZPS4,https://www.youtube.com/watch?v=2BIwPUhZPS4,"“SEMOGA BUR*NGMU GA BERDIRI LAGI!"" SUMPAH SEORANG ISTRI YG TERDZOLIMI !",UgxPDYfB8gDjfAsdmFN4AaABAg,@ariefarifin9227,Brarti emng si suaminya ini penyakit selingkuh ny dari dulu... yaa siap2 aja yg jd skrng d selingkuhin lagi...,2 bulan yang lalu,0,False,2025-12-20T09:29:52.667232+00:00,brarti emng si suaminya ini penyakit selingkuh ny dari dulu yaa siap2 aja yg jd skrng d selingkuhin lagi,negatif
youtube,2BIwPUhZPS4,https://www.youtube.com/watch?v=2BIwPUhZPS4,"“SEMOGA BUR*NGMU GA BERDIRI LAGI!"" SUMPAH SEORANG ISTRI YG TERDZOLIMI !",UgzQmsR39GtLXN6bNx94AaABAg,@bgdoi1457,Felling istri itu gak main2 loh . Apa yg di fellingkan itu nyata . Kuat bgt . Aku 5 tahun jdi istri stiap fellingku ke suami ku cari tau dan benar smua . Tpi syukurnya suamiku gak brselingkuh dan semoga di jauhkan dri itu . Kalo slingkuh dan KDRT aku gak bsa toleransi sih .,2 bulan yang lalu,0,False,2025-12-20T09:29:53.454241+00:00,felling istri itu gak main2 loh apa yg di fellingkan itu nyata kuat bgt aku 5 tahun jdi istri stiap fellingku ke suami ku cari tau dan benar smua tpi syukurnya suamiku gak brselingkuh dan semoga di jauhkan dri itu kalo slingkuh dan kdrt aku gak bsa toleransi sih,negatif
youtube,2BIwPUhZPS4,https://www.youtube.com/watch?v=2BIwPUhZPS4,"“SEMOGA BUR*NGMU GA BERDIRI LAGI!"" SUMPAH SEORANG ISTRI YG TERDZOLIMI !",UgwOMtMOYmc4MddfAUd4AaABAg,@Damagelayla1334,"Bang densu ajak podcast istri yg diselingkuhin sama suaminya yg seorang dokter bang, si suaminya malah lebih membela si pelakor dan lebih kejamnya satu alasan suaminya selingkuh karna istrinya sakit kanker",2 bulan yang lalu,0,False,2025-12-20T09:29:53.782058+00:00,bang densu ajak podcast istri yg diselingkuhin sama suaminya yg seorang dokter bang si suaminya malah lebih membela si pelakor dan lebih kejamnya satu alasan suaminya selingkuh karna istrinya sakit kanker,negatif
youtube,2BIwPUhZPS4,https://www.youtube.com/watch?v=2BIwPUhZPS4,"“SEMOGA BUR*NGMU GA BERDIRI LAGI!"" SUMPAH SEORANG ISTRI YG TERDZOLIMI !",UgxRO5YoK6n2wfIikIp4AaABAg,@dhewa1590,"Kasus perselingkuhan seperti ini, memang fakta lho. Buat pembelajaran untuk kita para perempuan. Saya pernah lihat tetangga depan rumah saya itu. Suaminya kan pengangguran, istrinya kerja. Ada janda datang ke rumah itu nagih hutang sama si suami orang itu, pas istrinya lagi kerja.saya udah 3 kali lihat janda itu datang",2 bulan yang lalu,0,False,2025-12-20T09:29:54.091659+00:00,kasus perselingkuhan seperti ini memang fakta lho buat pembelajaran untuk kita para perempuan saya pernah lihat tetangga depan rumah saya itu suaminya kan pengangguran istrinya kerja ada janda datang ke rumah itu nagih hutang sama si suami orang itu pas istrinya lagi kerja saya udah 3 kali lihat janda itu datang,negatif
youtube,2BIwPUhZPS4,https://www.youtube.com/watch?v=2BIwPUhZPS4,"“SEMOGA BUR*NGMU GA BERDIRI LAGI!"" SUMPAH SEORANG ISTRI YG TERDZOLIMI !",UgwfCbPShJcUQpUFXkp4AaABAg,@KRESENSIAlilis,"Temen temen saya kasih tau ya pengalaman saya, kalau pcran udah selingkuh2 tingalin dia gak akan berubah.. saya mengalaminya dan mbk ini",2 bulan yang lalu,12,False,2025-12-20T09:29:54.834108+00:00,temen temen saya kasih tau ya pengalaman saya kalau pcran udah selingkuh2 tingalin dia gak akan berubah saya mengalaminya dan mbk ini,negatif
youtube,2BIwPUhZPS4,https://www.youtube.com/watch?v=2BIwPUhZPS4,"“SEMOGA BUR*NGMU GA BERDIRI LAGI!"" SUMPAH SEORANG ISTRI YG TERDZOLIMI !",UgyBwO_pcxAD1zaG7Mh4AaABAg,@EtiSuhaeti-g8m,Insting istri itu sgt tajam..karena sy jg pernah ngalamin di selingkuhin suami beberapa kali....justru yg bilang mertuaku yg cewek .dgn bukti kecupan di leher setiap pulang kerja seminggu se x,2 bulan yang lalu,0,False,2025-12-20T09:29:55.135316+00:00,insting istri itu sgt tajam karena sy jg pernah ngalamin di selingkuhin suami beberapa kali justru yg bilang mertuaku yg cewek dgn bukti kecupan di leher setiap pulang kerja seminggu se x,negatif
youtube,2BIwPUhZPS4,https://www.youtube.com/watch?v=2BIwPUhZPS4,"“SEMOGA BUR*NGMU GA BERDIRI LAGI!"" SUMPAH SEORANG ISTRI YG TERDZOLIMI !",UgxuUChza1zA58YUvE14AaABAg,@istiqomahhasan5303,Kenapa sih cewe-cewe pada mau jadi selingkuhan?????? 😢,2 bulan yang lalu,0,False,2025-12-20T09:29:55.436219+00:00,kenapa sih cewe cewe pada mau jadi selingkuhan,negatif
youtube,2BIwPUhZPS4,https://www.youtube.com/watch?v=2BIwPUhZPS4,"“SEMOGA BUR*NGMU GA BERDIRI LAGI!"" SUMPAH SEORANG ISTRI YG TERDZOLIMI !",UgxWDmsbYQFBUBJE6vp4AaABAg,@ayumalang2424,"Tetap bersyukur dg segala cobaan ,, masih beruntung bisa ketahuan selingkuh lebih cepat , apa jadinya kalo ketahuan saat usia pernikahan udah lama ,,",2 bulan yang lalu,0,False,2025-12-20T09:29:56.115005+00:00,tetap bersyukur dg segala cobaan masih beruntung bisa ketahuan selingkuh lebih cepat apa jadinya kalo ketahuan saat usia pernikahan udah lama,negatif
youtube,2BIwPUhZPS4,https://www.youtube.com/watch?v=2BIwPUhZPS4,"“SEMOGA BUR*NGMU GA BERDIRI LAGI!"" SUMPAH SEORANG ISTRI YG TERDZOLIMI !",UgwTDHsH6stJpy3Gw6t4AaABAg,@iraariani6992,Aamiin Allahumma aamiin.... selingkuh dan kdrt adalah kesalahan yang tidak akan pernah bisa dimaafkan🤬 dalam rumah tangga,2 bulan yang lalu,0,False,2025-12-20T09:29:56.432213+00:00,aamiin allahumma aamiin selingkuh dan kdrt adalah kesalahan yang tidak akan pernah bisa dimaafkan dalam rumah tangga,negatif
youtube,2BIwPUhZPS4,https://www.youtube.com/watch?v=2BIwPUhZPS4,"“SEMOGA BUR*NGMU GA BERDIRI LAGI!"" SUMPAH SEORANG ISTRI YG TERDZOLIMI !",UgxmeueCEAKo_CQLzol4AaABAg,@SalsaBila-ez8vu,"klo udh selingkuh sekali udh si jangan di lanjutin krna selingkuh tu emng ga bisa di maafin krna hal tersebut bisa terulang Ulang ,jdi dri cerita beliau kita ambil hikmahnya laki' yg selingkuh tu emng b*ngsat",2 bulan yang lalu,0,False,2025-12-20T09:29:56.725716+00:00,klo udh selingkuh sekali udh si jangan di lanjutin krna selingkuh tu emng ga bisa di maafin krna hal tersebut bisa terulang ulang jdi dri cerita beliau kita ambil hikmahnya laki yg selingkuh tu emng b ngsat,negatif
youtube,2BIwPUhZPS4,https://www.youtube.com/watch?v=2BIwPUhZPS4,"“SEMOGA BUR*NGMU GA BERDIRI LAGI!"" SUMPAH SEORANG ISTRI YG TERDZOLIMI !",UgxzhstUr23GU0hGWp14AaABAg,@lidiadicahya8927,Pdhl orang selingkuh tuh ribet bgt ya,2 bulan yang lalu,0,False,2025-12-20T09:29:57.501805+00:00,pdhl orang selingkuh tuh ribet bgt ya,negatif
youtube,2BIwPUhZPS4,https://www.youtube.com/watch?v=2BIwPUhZPS4,"“SEMOGA BUR*NGMU GA BERDIRI LAGI!"" SUMPAH SEORANG ISTRI YG TERDZOLIMI !",UgwBF03n7rdKKwjKtf54AaABAg,@itsyoonsmoon,"Gengs, kalo pacar lo tukang selingkuh, jangan dilanjutin",2 bulan yang lalu,0,False,2025-12-20T09:29:57.797325+00:00,gengs kalo pacar lo tukang selingkuh jangan dilanjutin,negatif
youtube,2BIwPUhZPS4,https://www.youtube.com/watch?v=2BIwPUhZPS4,"“SEMOGA BUR*NGMU GA BERDIRI LAGI!"" SUMPAH SEORANG ISTRI YG TERDZOLIMI !",UgzN_Lxqexhq9pAexmh4AaABAg,@wenytjin4717,Jika pasangan dari pacaran sudah ada indikasi nyeleweng /selingkuh sebaiknya jangan lanjutkan karena itu pasti akan selingkuh  dalam perkawinan!!!!,2 bulan yang lalu,0,False,2025-12-20T09:29:58.093068+00:00,jika pasangan dari pacaran sudah ada indikasi nyeleweng selingkuh sebaiknya jangan lanjutkan karena itu pasti akan selingkuh dalam perkawinan,negatif
youtube,2BIwPUhZPS4,https://www.youtube.com/watch?v=2BIwPUhZPS4,"“SEMOGA BUR*NGMU GA BERDIRI LAGI!"" SUMPAH SEORANG ISTRI YG TERDZOLIMI !",UgylEDwsqWe8JTmIv-V4AaABAg,@anitasyargawi5288,Aduhhh udh dimanjaaa istrinya mash selingkuh 😢,2 bulan yang lalu,0,False,2025-12-20T09:29:58.392038+00:00,aduhhh udh dimanjaaa istrinya mash selingkuh,negatif
youtube,2BIwPUhZPS4,https://www.youtube.com/watch?v=2BIwPUhZPS4,"“SEMOGA BUR*NGMU GA BERDIRI LAGI!"" SUMPAH SEORANG ISTRI YG TERDZOLIMI !",UgyxnI3bMWXr6mwPAUt4AaABAg,@depotmanna1328,kalau laki-laki pacaran sudah selingkuh jangan pernah lanjut dijadikan suami,2 bulan yang lalu,0,False,2025-12-20T09:29:58.678167+00:00,kalau laki laki pacaran sudah selingkuh jangan pernah lanjut dijadikan suami,negatif
youtube,2BIwPUhZPS4,https://www.youtube.com/watch?v=2BIwPUhZPS4,"“SEMOGA BUR*NGMU GA BERDIRI LAGI!"" SUMPAH SEORANG ISTRI YG TERDZOLIMI !",UgyEO-gheY7Iv_u7WiZ4AaABAg,@IkohKomairoh,Hampir mirip seperti kisahku di selingkuhi suami 3x 😢,2 bulan yang lalu,0,False,2025-12-20T09:29:58.957661+00:00,hampir mirip seperti kisahku di selingkuhi suami 3x,negatif
youtube,2BIwPUhZPS4,https://www.youtube.com/watch?v=2BIwPUhZPS4,"“SEMOGA BUR*NGMU GA BERDIRI LAGI!"" SUMPAH SEORANG ISTRI YG TERDZOLIMI !",UgyDLEuPNgAB_KDp-5h4AaABAg,@NafilahIrhamMaulana,Emang bener ya selingkuh itu g ada obatnya😊,2 bulan yang lalu,0,False,2025-12-20T09:30:00.153139+00:00,emang bener ya selingkuh itu g ada obatnya,negatif
youtube,2BIwPUhZPS4,https://www.youtube.com/watch?v=2BIwPUhZPS4,"“SEMOGA BUR*NGMU GA BERDIRI LAGI!"" SUMPAH SEORANG ISTRI YG TERDZOLIMI !",UgzbXG5lGiKCyhNDgBF4AaABAg,@ahma9473,"Doaku kalau suami selingkuh juga gitu.. biar tau rasa dia, biar gak celap celup sana sini",2 bulan yang lalu,0,False,2025-12-20T09:30:00.423452+00:00,doaku kalau suami selingkuh juga gitu biar tau rasa dia biar gak celap celup sana sini,negatif
youtube,2BIwPUhZPS4,https://www.youtube.com/watch?v=2BIwPUhZPS4,"“SEMOGA BUR*NGMU GA BERDIRI LAGI!"" SUMPAH SEORANG ISTRI YG TERDZOLIMI !",UgwKUHOSaFGR6dAqDAV4AaABAg,@arulrivai6372,"BENCI GW Liat perselingkuhan bgini, BUAT gw pribadi selingkuh tu manusia titisan IBLIS ,😡 Selingkuh hal yg paling gw benci seumur hidup gw😡",2 bulan yang lalu,0,False,2025-12-20T09:30:00.714255+00:00,benci gw liat perselingkuhan bgini buat gw pribadi selingkuh tu manusia titisan iblis selingkuh hal yg paling gw benci seumur hidup gw,negatif
youtube,2BIwPUhZPS4,https://www.youtube.com/watch?v=2BIwPUhZPS4,"“SEMOGA BUR*NGMU GA BERDIRI LAGI!"" SUMPAH SEORANG ISTRI YG TERDZOLIMI !",Ugx6rU05nNW2EjZIl2p4AaABAg,@kittensjourney888,"Baik banget istri nya... masih bisa maafin, masih mikir aurat pelakor di dalam foto/vidio..",2 bulan yang lalu,0,False,2025-12-20T09:30:00.985233+00:00,baik banget istri nya masih bisa maafin masih mikir aurat pelakor di dalam foto vidio,negatif
youtube,2BIwPUhZPS4,https://www.youtube.com/watch?v=2BIwPUhZPS4,"“SEMOGA BUR*NGMU GA BERDIRI LAGI!"" SUMPAH SEORANG ISTRI YG TERDZOLIMI !",UgzX1qrZnxmrBr5mbSt4AaABAg,@keketanz,Selingkuh itu bnr2 penyakit.... jauhi laki2 spt ini. Gila ih,2 bulan yang lalu,0,False,2025-12-20T09:30:01.291740+00:00,selingkuh itu bnr2 penyakit jauhi laki2 spt ini gila ih,negatif
youtube,2BIwPUhZPS4,https://www.youtube.com/watch?v=2BIwPUhZPS4,"“SEMOGA BUR*NGMU GA BERDIRI LAGI!"" SUMPAH SEORANG ISTRI YG TERDZOLIMI !",UgzWDesroG25wd4R5VV4AaABAg,@indahpratiwi7015,Kyk kisah ku😢bedanya kk ini jumpa langsung dengan pelakornya klo sya hnya lewat chat ..,2 bulan yang lalu,0,False,2025-12-20T09:30:01.575748+00:00,kyk kisah ku bedanya kk ini jumpa langsung dengan pelakornya klo sya hnya lewat chat,negatif
youtube,2BIwPUhZPS4,https://www.youtube.com/watch?v=2BIwPUhZPS4,"“SEMOGA BUR*NGMU GA BERDIRI LAGI!"" SUMPAH SEORANG ISTRI YG TERDZOLIMI !",UgxmaeqACS1hwCHIULh4AaABAg.ANj5E2DRL4HAOWl_1ACcW1,@ruhpemburu6402,"Semenjak suamiku juga ketahuan selingkuh dan nama nya juga sama dgn nama mbak nya si P ini, astagaa jd benci nama P ini..",1 bulan yang lalu,2,False,2025-12-20T09:30:02.257227+00:00,semenjak suamiku juga ketahuan selingkuh dan nama nya juga sama dgn nama mbak nya si p ini astagaa jd benci nama p ini,negatif
youtube,2BIwPUhZPS4,https://www.youtube.com/watch?v=2BIwPUhZPS4,"“SEMOGA BUR*NGMU GA BERDIRI LAGI!"" SUMPAH SEORANG ISTRI YG TERDZOLIMI !",UgwNm4-dzDob9f52ctZ4AaABAg,@atikatik1362,Penting kita tau glagat suami....klo dah sering selingkuh tinggalin...g bkln kapok,2 bulan yang lalu,0,False,2025-12-20T09:30:03.009278+00:00,penting kita tau glagat suami klo dah sering selingkuh tinggalin g bkln kapok,negatif
youtube,2BIwPUhZPS4,https://www.youtube.com/watch?v=2BIwPUhZPS4,"“SEMOGA BUR*NGMU GA BERDIRI LAGI!"" SUMPAH SEORANG ISTRI YG TERDZOLIMI !",Ugw3sfeOVx7buX-PkiZ4AaABAg,@TasyaAngelinaAngelina,selingkuh  ibarat obat telarang guys ga bs di obati wkwkkwkw,2 bulan yang lalu,0,False,2025-12-20T09:30:03.293887+00:00,selingkuh ibarat obat telarang guys ga bs di obati wkwkkwkw,negatif
youtube,2BIwPUhZPS4,https://www.youtube.com/watch?v=2BIwPUhZPS4,"“SEMOGA BUR*NGMU GA BERDIRI LAGI!"" SUMPAH SEORANG ISTRI YG TERDZOLIMI !",Ugxfp4OfVJ6xy9oiBzh4AaABAg,@NoviAuliaDewiRasya,Laki2 yg punya penyakit selingkuh tdk akn pernah berubah kecuali dia udh mati!,2 bulan yang lalu,0,False,2025-12-20T09:30:03.576897+00:00,laki2 yg punya penyakit selingkuh tdk akn pernah berubah kecuali dia udh mati,negatif
youtube,2BIwPUhZPS4,https://www.youtube.com/watch?v=2BIwPUhZPS4,"“SEMOGA BUR*NGMU GA BERDIRI LAGI!"" SUMPAH SEORANG ISTRI YG TERDZOLIMI !",Ugwx2TboSUWk6rSzyb54AaABAg,@AleshaAlmahyra-s8k,"Memang laki"" Kalo pinter ngomong itu tukang selingkuh.",2 bulan yang lalu,0,False,2025-12-20T09:30:03.915795+00:00,memang laki kalo pinter ngomong itu tukang selingkuh,negatif
youtube,2BIwPUhZPS4,https://www.youtube.com/watch?v=2BIwPUhZPS4,"“SEMOGA BUR*NGMU GA BERDIRI LAGI!"" SUMPAH SEORANG ISTRI YG TERDZOLIMI !",Ugw9bx2YW4sho31S4Qd4AaABAg,@RajaSunda-p9v,Mendidih darah ini ketika denger kata selingkuh,2 bulan yang lalu,0,False,2025-12-20T09:30:04.222610+00:00,mendidih darah ini ketika denger kata selingkuh,negatif
youtube,2BIwPUhZPS4,https://www.youtube.com/watch?v=2BIwPUhZPS4,"“SEMOGA BUR*NGMU GA BERDIRI LAGI!"" SUMPAH SEORANG ISTRI YG TERDZOLIMI !",UgyeA4WBW8xHbUpKSX14AaABAg,@ScarletteViBritannia,"Lu yang kekeh mau, lu juga yang selingkuh, dih kocak.. 😭",2 bulan yang lalu,0,False,2025-12-20T09:30:04.522253+00:00,lu yang kekeh mau lu juga yang selingkuh dih kocak,negatif
youtube,2BIwPUhZPS4,https://www.youtube.com/watch?v=2BIwPUhZPS4,"“SEMOGA BUR*NGMU GA BERDIRI LAGI!"" SUMPAH SEORANG ISTRI YG TERDZOLIMI !",UgzlfB_8iU1OT1uzxB54AaABAg,@defuture-k1t,"Udahlah keinginan Si P tercapai krna udh bisa milikin suami org. Ntar jg ga lama paling suami hasil rebutan itu selingkuhin dia lagi krna mrasa ga bisa berdiri (impoten) mka akan nyri perempuan lgi 😂😂😂😂😂😂 tenang siklus setan itu cuma ada di isi kepala jdi selama edukasi seksual, edukasi parenting, edukasi pasangan, edukasi pernikahan ga ada dikepala si cowo banci itu ga ada maka jelas dia akan merasa kepuasan batin dan seksualnya hanya dari perempuan lain 😂😂😂. 

Jadi si P itu korban + pelaku yang juga sama tolol nya 😂 yakin gw si puput itu edukasi seksual, marriage, parenting dll sangat minim 😂 makanya isi otaknya cuma haus kasih sayang + haus kebatinan .",2 bulan yang lalu (diedit),0,False,2025-12-20T09:30:05.262261+00:00,udahlah keinginan si p tercapai krna udh bisa milikin suami org ntar jg ga lama paling suami hasil rebutan itu selingkuhin dia lagi krna mrasa ga bisa berdiri impoten mka akan nyri perempuan lgi tenang siklus setan itu cuma ada di isi kepala jdi selama edukasi seksual edukasi parenting edukasi pasangan edukasi pernikahan ga ada dikepala si cowo banci itu ga ada maka jelas dia akan merasa kepuasan batin dan seksualnya hanya dari perempuan lain jadi si p itu korban pelaku yang juga sama tolol nya yakin gw si puput itu edukasi seksual marriage parenting dll sangat minim makanya isi otaknya cuma haus kasih sayang haus kebatinan,negatif
youtube,2BIwPUhZPS4,https://www.youtube.com/watch?v=2BIwPUhZPS4,"“SEMOGA BUR*NGMU GA BERDIRI LAGI!"" SUMPAH SEORANG ISTRI YG TERDZOLIMI !",Ugxape6KhWIy8EW-i6Z4AaABAg,@Sitakurnia,"Ini jadi bahan pelajaran buat semua manusia harus SETIA, terkhusus buat yg sudah menikah, berpikir 1000x sblm berbuat, zaman sekarang uda canggih cepat banget mekanikan isu perselingkuhan, efek saksi sosial nyata buat semua orang yg terikat.",2 bulan yang lalu,0,False,2025-12-20T09:30:05.549135+00:00,ini jadi bahan pelajaran buat semua manusia harus setia terkhusus buat yg sudah menikah berpikir 1000x sblm berbuat zaman sekarang uda canggih cepat banget mekanikan isu perselingkuhan efek saksi sosial nyata buat semua orang yg terikat,negatif
youtube,2BIwPUhZPS4,https://www.youtube.com/watch?v=2BIwPUhZPS4,"“SEMOGA BUR*NGMU GA BERDIRI LAGI!"" SUMPAH SEORANG ISTRI YG TERDZOLIMI !",Ugw_viyZ9EShYmZd4_l4AaABAg,@trivajardin8999,Sangat2 penting  buat kami perempuan2 apa lg yg baru menikah. yg gk suka dengan podcas gini mungkin dia calon pelakor atau sudah jadi pelakor atau bahkan senior pelakor.,2 bulan yang lalu,0,False,2025-12-20T09:30:05.865552+00:00,sangat2 penting buat kami perempuan2 apa lg yg baru menikah yg gk suka dengan podcas gini mungkin dia calon pelakor atau sudah jadi pelakor atau bahkan senior pelakor,negatif
youtube,2BIwPUhZPS4,https://www.youtube.com/watch?v=2BIwPUhZPS4,"“SEMOGA BUR*NGMU GA BERDIRI LAGI!"" SUMPAH SEORANG ISTRI YG TERDZOLIMI !",UgzBz4qxcn-0cioH3rd4AaABAg,@trivajardin8999,Sangat2 penting  buat kami perempuan2 apa lg yg baru menikah. yg gk suka dengan podcas gini mungkin dia calon pelakor atau sudah jadi pelakor atau bahkan senior pelakor.,2 bulan yang lalu,0,False,2025-12-20T09:30:06.139289+00:00,sangat2 penting buat kami perempuan2 apa lg yg baru menikah yg gk suka dengan podcas gini mungkin dia calon pelakor atau sudah jadi pelakor atau bahkan senior pelakor,negatif
youtube,2BIwPUhZPS4,https://www.youtube.com/watch?v=2BIwPUhZPS4,"“SEMOGA BUR*NGMU GA BERDIRI LAGI!"" SUMPAH SEORANG ISTRI YG TERDZOLIMI !",UgwJ9X3oFXfyfXiuZiN4AaABAg,@yennidamayanti3309,"Baguslah cerai..lakinya doyan selingkuh dan itu penyakit yang ga akan pernah sembuh. Ntar kalaupun si laki nikah dengan putri, dia juga tetap akan selingkuh",2 bulan yang lalu,1,False,2025-12-20T09:30:06.414359+00:00,baguslah cerai lakinya doyan selingkuh dan itu penyakit yang ga akan pernah sembuh ntar kalaupun si laki nikah dengan putri dia juga tetap akan selingkuh,negatif
youtube,2BIwPUhZPS4,https://www.youtube.com/watch?v=2BIwPUhZPS4,"“SEMOGA BUR*NGMU GA BERDIRI LAGI!"" SUMPAH SEORANG ISTRI YG TERDZOLIMI !",Ugw3cWEbR_A_NdocCll4AaABAg,@rindisetiawati9611,"Bang undang istrinya dr jerry yg jadi korban selingkuhan juga,, kasihan istri nya katanya derita kanker",2 bulan yang lalu,0,False,2025-12-20T09:30:07.141872+00:00,bang undang istrinya dr jerry yg jadi korban selingkuhan juga kasihan istri nya katanya derita kanker,negatif
youtube,2BIwPUhZPS4,https://www.youtube.com/watch?v=2BIwPUhZPS4,"“SEMOGA BUR*NGMU GA BERDIRI LAGI!"" SUMPAH SEORANG ISTRI YG TERDZOLIMI !",UgxQW-Hc_SI7c4-1qTB4AaABAg,@BuchoryImam,Selingkuh itu gak ada sembuhnya gays.. susah,2 bulan yang lalu,0,False,2025-12-20T09:30:07.477243+00:00,selingkuh itu gak ada sembuhnya gays susah,negatif
youtube,2BIwPUhZPS4,https://www.youtube.com/watch?v=2BIwPUhZPS4,"“SEMOGA BUR*NGMU GA BERDIRI LAGI!"" SUMPAH SEORANG ISTRI YG TERDZOLIMI !",UgxiVTpLKY4AAWPNckR4AaABAg,@RamaDhani-jx7mz,"udah beberapa x selingkuh, jln sm cew lain masih dimaafin????? dipertahanin dr pertama  KOCAK 😂😂😂😂😂😂",2 bulan yang lalu,1,False,2025-12-20T09:30:07.756430+00:00,udah beberapa x selingkuh jln sm cew lain masih dimaafin dipertahanin dr pertama kocak,negatif
youtube,2BIwPUhZPS4,https://www.youtube.com/watch?v=2BIwPUhZPS4,"“SEMOGA BUR*NGMU GA BERDIRI LAGI!"" SUMPAH SEORANG ISTRI YG TERDZOLIMI !",Ugwn_7wqrn_dVwLF9ux4AaABAg,@irma_erviana7,"Selingkuh itu penyakit,, swt saat akan kambuh.. maka jgn di beri toleransi unk masalah sprti ini.

Istri nya baik, cantik & tdk posesif, kurang apa sih? Dasar lelaki tdk bersyukur.

Dek, udah keputusan yg tepat membuang suami nya, semoga next mendapatkan pengganti nya yg jauh lbh baik 🤲🏻",2 bulan yang lalu (diedit),0,False,2025-12-20T09:30:08.065546+00:00,selingkuh itu penyakit swt saat akan kambuh maka jgn di beri toleransi unk masalah sprti ini istri nya baik cantik tdk posesif kurang apa sih dasar lelaki tdk bersyukur dek udah keputusan yg tepat membuang suami nya semoga next mendapatkan pengganti nya yg jauh lbh baik,negatif
youtube,2BIwPUhZPS4,https://www.youtube.com/watch?v=2BIwPUhZPS4,"“SEMOGA BUR*NGMU GA BERDIRI LAGI!"" SUMPAH SEORANG ISTRI YG TERDZOLIMI !",UgxU0icIHdW7lUrde8B4AaABAg,@adekeke784,Jngn percaya am CWOK yg ud pernah selingkuh selingkuh itu biat dn bakal di ulangn lgi,2 bulan yang lalu,0,False,2025-12-20T09:30:08.829832+00:00,jngn percaya am cwok yg ud pernah selingkuh selingkuh itu biat dn bakal di ulangn lgi,negatif
youtube,2BIwPUhZPS4,https://www.youtube.com/watch?v=2BIwPUhZPS4,"“SEMOGA BUR*NGMU GA BERDIRI LAGI!"" SUMPAH SEORANG ISTRI YG TERDZOLIMI !",UgzzqRp8svR_IrOohpV4AaABAg,@Haltraazura,Aku pernah diposisi ini 😢 dan aku msh memaafkannya trnyata smpai sekarang penyakit selingkuh itu msh dia pertahanin 😥😭,2 bulan yang lalu,0,False,2025-12-20T09:30:09.125974+00:00,aku pernah diposisi ini dan aku msh memaafkannya trnyata smpai sekarang penyakit selingkuh itu msh dia pertahanin,negatif
youtube,2BIwPUhZPS4,https://www.youtube.com/watch?v=2BIwPUhZPS4,"“SEMOGA BUR*NGMU GA BERDIRI LAGI!"" SUMPAH SEORANG ISTRI YG TERDZOLIMI !",UgwwXabmt7dNAxnxwMN4AaABAg,@EndahBuriH,"Orang yg terbiasa melakukan yg haram akan diuji tidak akan bisa menikmati yg halal.Suami yg lebih senang dengan selingkuhannya(pasangan haram)karena sudah dicabut kenikmatannya dengan istrinya(pasangan halalnya)karena memang terbiasa melakukan yg haram2.Obatnya cuma 1,bertaubat nasuha,ruqyah,dan memperbanyak ibadah,dan bertekad dengan sungguh2 untuk tidak mengulanginya lg.",2 bulan yang lalu,0,False,2025-12-20T09:30:09.455564+00:00,orang yg terbiasa melakukan yg haram akan diuji tidak akan bisa menikmati yg halal suami yg lebih senang dengan selingkuhannya pasangan haram karena sudah dicabut kenikmatannya dengan istrinya pasangan halalnya karena memang terbiasa melakukan yg haram2 obatnya cuma 1 bertaubat nasuha ruqyah dan memperbanyak ibadah dan bertekad dengan sungguh2 untuk tidak mengulanginya lg,negatif
youtube,2BIwPUhZPS4,https://www.youtube.com/watch?v=2BIwPUhZPS4,"“SEMOGA BUR*NGMU GA BERDIRI LAGI!"" SUMPAH SEORANG ISTRI YG TERDZOLIMI !",Ugxtszi0oMkymTvARnR4AaABAg,@AniAni-d2y,"Berarti yg goblok siapa .. si cewek kan ?
Udah tau pernah selingkuh tapi aja lanjutt 😊😊",2 bulan yang lalu,0,False,2025-12-20T09:30:10.173229+00:00,berarti yg goblok siapa si cewek kan udah tau pernah selingkuh tapi aja lanjutt,negatif
youtube,2BIwPUhZPS4,https://www.youtube.com/watch?v=2BIwPUhZPS4,"“SEMOGA BUR*NGMU GA BERDIRI LAGI!"" SUMPAH SEORANG ISTRI YG TERDZOLIMI !",UgyfYtOrw1SQN4lUx8x4AaABAg,@annisaicha4449,"Padahal dari awal emang karakter selingkuh, tetap dilanjut😂",2 bulan yang lalu,0,False,2025-12-20T09:30:10.441823+00:00,padahal dari awal emang karakter selingkuh tetap dilanjut,negatif
youtube,2BIwPUhZPS4,https://www.youtube.com/watch?v=2BIwPUhZPS4,"“SEMOGA BUR*NGMU GA BERDIRI LAGI!"" SUMPAH SEORANG ISTRI YG TERDZOLIMI !",UgxloDR84oSXDLkzJUB4AaABAg,@rvofficial3978,JANGAN NORMALISASI PERSELINGKUHAN,2 bulan yang lalu,0,False,2025-12-20T09:30:10.742464+00:00,jangan normalisasi perselingkuhan,negatif
youtube,2BIwPUhZPS4,https://www.youtube.com/watch?v=2BIwPUhZPS4,"“SEMOGA BUR*NGMU GA BERDIRI LAGI!"" SUMPAH SEORANG ISTRI YG TERDZOLIMI !",Ugy4eiNJ1afSP0NUwiN4AaABAg,@t400-s1e,Dari yg sdh2 sy belajar sekali selingkuh dimaafin tuman. 😢,2 bulan yang lalu,0,False,2025-12-20T09:30:11.066852+00:00,dari yg sdh2 sy belajar sekali selingkuh dimaafin tuman,negatif
