platform,video_id,video_url,video_title,comment_id,author,text,time,votes,heart,fetched_utc,text_clean,sentimen_rule
youtube,2BIwPUhZPS4,https://www.youtube.com/watch?v=2BIwPUhZPS4,"“SEMOGA BUR*NGMU GA BERDIRI LAGI!"" SUMPAH SEORANG ISTRI YG TERDZOLIMI !",Ugzezm6wtfYl0oBYxuF4AaABAg,@BintangArahman-d6p,"Saya pernah d posisi itu, 😭😭moga laki2 yg selingkuh ada istriy moga doay terkabul... Gak bisa bangun slamay burungy",4 hari yang lalu,0,False,2025-12-20T09:26:03.365977+00:00,saya pernah d posisi itu moga laki2 yg selingkuh ada istriy moga doay terkabul gak bisa bangun slamay burungy,negatif
youtube,2BIwPUhZPS4,https://www.youtube.com/watch?v=2BIwPUhZPS4,"“SEMOGA BUR*NGMU GA BERDIRI LAGI!"" SUMPAH SEORANG ISTRI YG TERDZOLIMI !",UgwyapzqNzvGSz7ucwN4AaABAg,@RudiHartono-fl4hq,"Apakah mungkin jika suami mau poligami yg sah secara agama islam tidak dimulai dari perselingkuhan, termasuk selingkuh hati, pikiran, dan mata?
Apa mungkin suami mau menikah lagi atau poligami tanpa melihat, tanpa memikirkan, dan tanpa meresapi perasaan ke calon pasangan poligaminya sehingga tidak bisa disebut selingkuh tapi murni poligami tanpa ada selingkuh  fisik, mata, hati dan pikiran dari istri sah dan suami mau menikah lagi hanya modal tau nama saja tau orang saja tanpa ada perasaan sama sekali sedangkan suami wajib memberi nafkah batin ke istri yg akan dipoligami, apakah berhubungan badan tanpa ada perasaan diantara pasangan dapat disebut nafka batin atau hanya nafsu birahi saja.",4 hari yang lalu (diedit),0,False,2025-12-20T09:26:03.679202+00:00,apakah mungkin jika suami mau poligami yg sah secara agama islam tidak dimulai dari perselingkuhan termasuk selingkuh hati pikiran dan mata apa mungkin suami mau menikah lagi atau poligami tanpa melihat tanpa memikirkan dan tanpa meresapi perasaan ke calon pasangan poligaminya sehingga tidak bisa disebut selingkuh tapi murni poligami tanpa ada selingkuh fisik mata hati dan pikiran dari istri sah dan suami mau menikah lagi hanya modal tau nama saja tau orang saja tanpa ada perasaan sama sekali sedangkan suami wajib memberi nafkah batin ke istri yg akan dipoligami apakah berhubungan badan tanpa ada perasaan diantara pasangan dapat disebut nafka batin atau hanya nafsu birahi saja,negatif
youtube,2BIwPUhZPS4,https://www.youtube.com/watch?v=2BIwPUhZPS4,"“SEMOGA BUR*NGMU GA BERDIRI LAGI!"" SUMPAH SEORANG ISTRI YG TERDZOLIMI !",UgzSqI-BURADwwCQFh14AaABAg.ANSz1PTnLvPANT57IrqHYF,@arifahnur_575,Jangan jangan akun pelakornya ni mangkannya kga demen😂,2 bulan yang lalu,"1,9 rb",False,2025-12-20T09:26:04.924488+00:00,jangan jangan akun pelakornya ni mangkannya kga demen,negatif
youtube,2BIwPUhZPS4,https://www.youtube.com/watch?v=2BIwPUhZPS4,"“SEMOGA BUR*NGMU GA BERDIRI LAGI!"" SUMPAH SEORANG ISTRI YG TERDZOLIMI !",UgzSqI-BURADwwCQFh14AaABAg.ANSz1PTnLvPANT5GsfUuyK,@Firmansyah-xw2zn,Ini paling keluarga laki nya atau pelakor nya haha,2 bulan yang lalu,710,False,2025-12-20T09:26:06.248752+00:00,ini paling keluarga laki nya atau pelakor nya haha,negatif
youtube,2BIwPUhZPS4,https://www.youtube.com/watch?v=2BIwPUhZPS4,"“SEMOGA BUR*NGMU GA BERDIRI LAGI!"" SUMPAH SEORANG ISTRI YG TERDZOLIMI !",UgzSqI-BURADwwCQFh14AaABAg.ANSz1PTnLvPANT5MWZiP53,@dianaselasih9914,ini palingg mantan suami nih atau g pelakorrr😂,2 bulan yang lalu,340,False,2025-12-20T09:26:06.611054+00:00,ini palingg mantan suami nih atau g pelakorrr,negatif
youtube,2BIwPUhZPS4,https://www.youtube.com/watch?v=2BIwPUhZPS4,"“SEMOGA BUR*NGMU GA BERDIRI LAGI!"" SUMPAH SEORANG ISTRI YG TERDZOLIMI !",UgzSqI-BURADwwCQFh14AaABAg.ANSz1PTnLvPANT8uXs3v0P,@PaopaoRiin,​ @ahmaddanidalimunthe915 sprti nya slh 1 pelakor si putri hahaha,2 bulan yang lalu,0,False,2025-12-20T09:26:06.969164+00:00,ahmaddanidalimunthe915 sprti nya slh 1 pelakor si putri hahaha,negatif
youtube,2BIwPUhZPS4,https://www.youtube.com/watch?v=2BIwPUhZPS4,"“SEMOGA BUR*NGMU GA BERDIRI LAGI!"" SUMPAH SEORANG ISTRI YG TERDZOLIMI !",UgzSqI-BURADwwCQFh14AaABAg.ANSz1PTnLvPANTYhl-kOfE,@niva1002,@ahmaddanidalimunthe915 keluarganya si pelakor itu wkwkwk,2 bulan yang lalu,0,False,2025-12-20T09:26:07.236740+00:00,ahmaddanidalimunthe915 keluarganya si pelakor itu wkwkwk,negatif
youtube,2BIwPUhZPS4,https://www.youtube.com/watch?v=2BIwPUhZPS4,"“SEMOGA BUR*NGMU GA BERDIRI LAGI!"" SUMPAH SEORANG ISTRI YG TERDZOLIMI !",UgzSqI-BURADwwCQFh14AaABAg.ANSz1PTnLvPANTBZ2eZx9e,@GHANYGarden,​ @ameliaarst pasti itu sesama pelakor atau adeknya pelakornya kak😁,2 bulan yang lalu,0,False,2025-12-20T09:26:07.538515+00:00,ameliaarst pasti itu sesama pelakor atau adeknya pelakornya kak,negatif
youtube,2BIwPUhZPS4,https://www.youtube.com/watch?v=2BIwPUhZPS4,"“SEMOGA BUR*NGMU GA BERDIRI LAGI!"" SUMPAH SEORANG ISTRI YG TERDZOLIMI !",UgzSqI-BURADwwCQFh14AaABAg.ANSz1PTnLvPANU1V5n7xQu,@richiv6681,​​ @ameliaarst apa mungkin ini keluarga pelakor itu ya???,2 bulan yang lalu (diedit),0,False,2025-12-20T09:26:07.813772+00:00,ameliaarst apa mungkin ini keluarga pelakor itu ya,negatif
youtube,2BIwPUhZPS4,https://www.youtube.com/watch?v=2BIwPUhZPS4,"“SEMOGA BUR*NGMU GA BERDIRI LAGI!"" SUMPAH SEORANG ISTRI YG TERDZOLIMI !",UgzSqI-BURADwwCQFh14AaABAg.ANSz1PTnLvPANT6UWrH6lU,@asapp378,Mungkin keluarga pelakor nih,2 bulan yang lalu,34,False,2025-12-20T09:26:08.958292+00:00,mungkin keluarga pelakor nih,negatif
youtube,2BIwPUhZPS4,https://www.youtube.com/watch?v=2BIwPUhZPS4,"“SEMOGA BUR*NGMU GA BERDIRI LAGI!"" SUMPAH SEORANG ISTRI YG TERDZOLIMI !",UgzSqI-BURADwwCQFh14AaABAg.ANSz1PTnLvPANT6O0-FNzE,@rinirahma1527,Pasti pihak dr pelakor 😅,2 bulan yang lalu,81,False,2025-12-20T09:26:10.297132+00:00,pasti pihak dr pelakor,negatif
youtube,2BIwPUhZPS4,https://www.youtube.com/watch?v=2BIwPUhZPS4,"“SEMOGA BUR*NGMU GA BERDIRI LAGI!"" SUMPAH SEORANG ISTRI YG TERDZOLIMI !",UgzSqI-BURADwwCQFh14AaABAg.ANSz1PTnLvPANT7KpxRU97,@sammyvino06,"Lah, ini yang suka selingkuh jangan2 wkwkwkwk",2 bulan yang lalu,18,False,2025-12-20T09:26:10.614086+00:00,lah ini yang suka selingkuh jangan2 wkwkwkwk,negatif
youtube,2BIwPUhZPS4,https://www.youtube.com/watch?v=2BIwPUhZPS4,"“SEMOGA BUR*NGMU GA BERDIRI LAGI!"" SUMPAH SEORANG ISTRI YG TERDZOLIMI !",UgzSqI-BURADwwCQFh14AaABAg.ANSz1PTnLvPANT5VYFY78K,@sahaboa816,"Klo g sodra pelakor nya,tmnya yg dukung,atau sma” pelakor juga ini yg komen",2 bulan yang lalu,180,False,2025-12-20T09:26:10.962577+00:00,klo g sodra pelakor nya tmnya yg dukung atau sma pelakor juga ini yg komen,negatif
youtube,2BIwPUhZPS4,https://www.youtube.com/watch?v=2BIwPUhZPS4,"“SEMOGA BUR*NGMU GA BERDIRI LAGI!"" SUMPAH SEORANG ISTRI YG TERDZOLIMI !",UgzSqI-BURADwwCQFh14AaABAg.ANSz1PTnLvPANT6If9gmXF,@elsanovarahmawati4153,Jangan-jangan antek-antek selingkuhannya nih😂,2 bulan yang lalu,70,False,2025-12-20T09:26:11.286123+00:00,jangan jangan antek antek selingkuhannya nih,negatif
youtube,2BIwPUhZPS4,https://www.youtube.com/watch?v=2BIwPUhZPS4,"“SEMOGA BUR*NGMU GA BERDIRI LAGI!"" SUMPAH SEORANG ISTRI YG TERDZOLIMI !",UgzSqI-BURADwwCQFh14AaABAg.ANSz1PTnLvPANT7TAxHppS,@bbylenn_5,ini sodara pelakor yaa? bernau bgtt komen kek gini😂,2 bulan yang lalu,12,False,2025-12-20T09:26:11.582582+00:00,ini sodara pelakor yaa bernau bgtt komen kek gini,negatif
youtube,2BIwPUhZPS4,https://www.youtube.com/watch?v=2BIwPUhZPS4,"“SEMOGA BUR*NGMU GA BERDIRI LAGI!"" SUMPAH SEORANG ISTRI YG TERDZOLIMI !",UgzSqI-BURADwwCQFh14AaABAg.ANSz1PTnLvPANT8BInuvKW,@viralvideos1070,"si pelakor trsinggung jg nih, wkwkwk 🤣",2 bulan yang lalu,11,False,2025-12-20T09:26:12.850066+00:00,si pelakor trsinggung jg nih wkwkwk,negatif
youtube,2BIwPUhZPS4,https://www.youtube.com/watch?v=2BIwPUhZPS4,"“SEMOGA BUR*NGMU GA BERDIRI LAGI!"" SUMPAH SEORANG ISTRI YG TERDZOLIMI !",UgzSqI-BURADwwCQFh14AaABAg.ANSz1PTnLvPANT7QkbPB6N,@ErosYadi-l3u,"Ya penting lah biar ada gambaran orang tolil suka selingkuh ,penonyon baru kayaknya,apa buzzzer😂",2 bulan yang lalu,9,False,2025-12-20T09:26:13.199605+00:00,ya penting lah biar ada gambaran orang tolil suka selingkuh penonyon baru kayaknya apa buzzzer,negatif
youtube,2BIwPUhZPS4,https://www.youtube.com/watch?v=2BIwPUhZPS4,"“SEMOGA BUR*NGMU GA BERDIRI LAGI!"" SUMPAH SEORANG ISTRI YG TERDZOLIMI !",UgzSqI-BURADwwCQFh14AaABAg.ANSz1PTnLvPANT8HzHQdCM,@miaballa9055,Wah konco” nya si pelakor ini 😂😂😂,2 bulan yang lalu,7,False,2025-12-20T09:26:14.132295+00:00,wah konco nya si pelakor ini,negatif
youtube,2BIwPUhZPS4,https://www.youtube.com/watch?v=2BIwPUhZPS4,"“SEMOGA BUR*NGMU GA BERDIRI LAGI!"" SUMPAH SEORANG ISTRI YG TERDZOLIMI !",UgzSqI-BURADwwCQFh14AaABAg.ANSz1PTnLvPANT8KFSqluW,@gilanggumati3945,Kayaknya yg komen ini sejenis sama si pelakor atau tukang selingkuhnya.. makanya dia gak suka. 😂😂😂,2 bulan yang lalu,7,False,2025-12-20T09:26:14.414310+00:00,kayaknya yg komen ini sejenis sama si pelakor atau tukang selingkuhnya makanya dia gak suka,negatif
youtube,2BIwPUhZPS4,https://www.youtube.com/watch?v=2BIwPUhZPS4,"“SEMOGA BUR*NGMU GA BERDIRI LAGI!"" SUMPAH SEORANG ISTRI YG TERDZOLIMI !",UgzSqI-BURADwwCQFh14AaABAg.ANSz1PTnLvPANT8k_Z2Wi9,@adhytbolder,PELAKOR KAH? 😂😂😂😂😂,2 bulan yang lalu,6,False,2025-12-20T09:26:15.523254+00:00,pelakor kah,negatif
youtube,2BIwPUhZPS4,https://www.youtube.com/watch?v=2BIwPUhZPS4,"“SEMOGA BUR*NGMU GA BERDIRI LAGI!"" SUMPAH SEORANG ISTRI YG TERDZOLIMI !",UgzSqI-BURADwwCQFh14AaABAg.ANSz1PTnLvPANT95kkWSV1,@jessikaaprillia,kamu akun fake pelakor atau kerabat pelakor?😂,2 bulan yang lalu,5,False,2025-12-20T09:26:15.833213+00:00,kamu akun fake pelakor atau kerabat pelakor,negatif
youtube,2BIwPUhZPS4,https://www.youtube.com/watch?v=2BIwPUhZPS4,"“SEMOGA BUR*NGMU GA BERDIRI LAGI!"" SUMPAH SEORANG ISTRI YG TERDZOLIMI !",UgzSqI-BURADwwCQFh14AaABAg.ANSz1PTnLvPANT6zVMVi_I,@IraFajarwati-k4r,Ciecie bagian pelakor y😅😅😅,2 bulan yang lalu,32,False,2025-12-20T09:26:16.760042+00:00,ciecie bagian pelakor y,negatif
youtube,2BIwPUhZPS4,https://www.youtube.com/watch?v=2BIwPUhZPS4,"“SEMOGA BUR*NGMU GA BERDIRI LAGI!"" SUMPAH SEORANG ISTRI YG TERDZOLIMI !",UgzSqI-BURADwwCQFh14AaABAg.ANSz1PTnLvPANT77knKuJn,@ayupermatasari3679,Pelaku perselingkuhan ya sampe gada simpati dan empatinya?😂,2 bulan yang lalu,22,False,2025-12-20T09:26:18.711804+00:00,pelaku perselingkuhan ya sampe gada simpati dan empatinya,negatif
youtube,2BIwPUhZPS4,https://www.youtube.com/watch?v=2BIwPUhZPS4,"“SEMOGA BUR*NGMU GA BERDIRI LAGI!"" SUMPAH SEORANG ISTRI YG TERDZOLIMI !",UgzSqI-BURADwwCQFh14AaABAg.ANSz1PTnLvPANTD2bXy1yR,@byarkalord8384,jangan2 akun jadi2an pelakor....,2 bulan yang lalu,2,False,2025-12-20T09:26:19.084452+00:00,jangan2 akun jadi2an pelakor,negatif
youtube,2BIwPUhZPS4,https://www.youtube.com/watch?v=2BIwPUhZPS4,"“SEMOGA BUR*NGMU GA BERDIRI LAGI!"" SUMPAH SEORANG ISTRI YG TERDZOLIMI !",UgzSqI-BURADwwCQFh14AaABAg.ANSz1PTnLvPANTKKb5eGC1,@dibbb-boo,Ini selingkuhannya kh? Atau pelaku?,2 bulan yang lalu,2,False,2025-12-20T09:26:20.473098+00:00,ini selingkuhannya kh atau pelaku,negatif
youtube,2BIwPUhZPS4,https://www.youtube.com/watch?v=2BIwPUhZPS4,"“SEMOGA BUR*NGMU GA BERDIRI LAGI!"" SUMPAH SEORANG ISTRI YG TERDZOLIMI !",UgzSqI-BURADwwCQFh14AaABAg.ANSz1PTnLvPANT6KhKCFJQ,@alfianfajaranggoro,keluarga pelakornya ini mah,2 bulan yang lalu,1,False,2025-12-20T09:26:21.724950+00:00,keluarga pelakornya ini mah,negatif
youtube,2BIwPUhZPS4,https://www.youtube.com/watch?v=2BIwPUhZPS4,"“SEMOGA BUR*NGMU GA BERDIRI LAGI!"" SUMPAH SEORANG ISTRI YG TERDZOLIMI !",UgzSqI-BURADwwCQFh14AaABAg.ANSz1PTnLvPANTD6yIgN5C,@CutSyitha,Mmg plg bnyk kasus hidup itu selingkuh . Anggap ini tontonan adlh pelajaran hidup buat yg suka main gila,2 bulan yang lalu,1,False,2025-12-20T09:26:22.656629+00:00,mmg plg bnyk kasus hidup itu selingkuh anggap ini tontonan adlh pelajaran hidup buat yg suka main gila,negatif
youtube,2BIwPUhZPS4,https://www.youtube.com/watch?v=2BIwPUhZPS4,"“SEMOGA BUR*NGMU GA BERDIRI LAGI!"" SUMPAH SEORANG ISTRI YG TERDZOLIMI !",UgzSqI-BURADwwCQFh14AaABAg.ANSz1PTnLvPANTDhrAAijV,@Tataaaa19,Jangan2 ni akun si pelakor 😂,2 bulan yang lalu (diedit),1,False,2025-12-20T09:26:23.087642+00:00,jangan2 ni akun si pelakor,negatif
youtube,2BIwPUhZPS4,https://www.youtube.com/watch?v=2BIwPUhZPS4,"“SEMOGA BUR*NGMU GA BERDIRI LAGI!"" SUMPAH SEORANG ISTRI YG TERDZOLIMI !",UgzSqI-BURADwwCQFh14AaABAg.ANSz1PTnLvPANTH13hHOMn,@sasabilanuraini,Akun pelakor ny kali wkwkkw,2 bulan yang lalu,1,False,2025-12-20T09:26:24.280148+00:00,akun pelakor ny kali wkwkkw,negatif
youtube,2BIwPUhZPS4,https://www.youtube.com/watch?v=2BIwPUhZPS4,"“SEMOGA BUR*NGMU GA BERDIRI LAGI!"" SUMPAH SEORANG ISTRI YG TERDZOLIMI !",UgzSqI-BURADwwCQFh14AaABAg.ANSz1PTnLvPANTJpUAsN57,@nurlitaafianti1843,Keluarga pelakornya y??,2 bulan yang lalu,1,False,2025-12-20T09:26:26.092669+00:00,keluarga pelakornya y,negatif
youtube,2BIwPUhZPS4,https://www.youtube.com/watch?v=2BIwPUhZPS4,"“SEMOGA BUR*NGMU GA BERDIRI LAGI!"" SUMPAH SEORANG ISTRI YG TERDZOLIMI !",UgzSqI-BURADwwCQFh14AaABAg.ANSz1PTnLvPANTKcuzXFKf,@BebyFiz,Temen pelakor kali nih dia😂,2 bulan yang lalu,1,False,2025-12-20T09:26:26.468581+00:00,temen pelakor kali nih dia,negatif
youtube,2BIwPUhZPS4,https://www.youtube.com/watch?v=2BIwPUhZPS4,"“SEMOGA BUR*NGMU GA BERDIRI LAGI!"" SUMPAH SEORANG ISTRI YG TERDZOLIMI !",UgzSqI-BURADwwCQFh14AaABAg.ANSz1PTnLvPANTMKGbBP7S,@elitagregoriana4466,Keluarga sih selingkuhan yah ?,2 bulan yang lalu,1,False,2025-12-20T09:26:27.366647+00:00,keluarga sih selingkuhan yah,negatif
youtube,2BIwPUhZPS4,https://www.youtube.com/watch?v=2BIwPUhZPS4,"“SEMOGA BUR*NGMU GA BERDIRI LAGI!"" SUMPAH SEORANG ISTRI YG TERDZOLIMI !",UgzSqI-BURADwwCQFh14AaABAg.ANSz1PTnLvPANTMkaVFlYP,@AldiiSopian,Ga suka skip ribet amat mbak apa kamu selingkuhanya😅,2 bulan yang lalu,1,False,2025-12-20T09:26:27.727741+00:00,ga suka skip ribet amat mbak apa kamu selingkuhanya,negatif
youtube,2BIwPUhZPS4,https://www.youtube.com/watch?v=2BIwPUhZPS4,"“SEMOGA BUR*NGMU GA BERDIRI LAGI!"" SUMPAH SEORANG ISTRI YG TERDZOLIMI !",UgzSqI-BURADwwCQFh14AaABAg.ANSz1PTnLvPANTNQd6wk1v,@lindawahyuning97,"Ini penting,, manfaatnya biar wanita mikir kalo predator gak bisa dimaafin terus. Orang sayang gak akan selingkuh.",2 bulan yang lalu,1,False,2025-12-20T09:26:28.046033+00:00,ini penting manfaatnya biar wanita mikir kalo predator gak bisa dimaafin terus orang sayang gak akan selingkuh,negatif
youtube,2BIwPUhZPS4,https://www.youtube.com/watch?v=2BIwPUhZPS4,"“SEMOGA BUR*NGMU GA BERDIRI LAGI!"" SUMPAH SEORANG ISTRI YG TERDZOLIMI !",UgzSqI-BURADwwCQFh14AaABAg.ANSz1PTnLvPANTNgUjJTOz,@sandyhasmawan3512,wkwkw jangan jangan keluarganya si pelakor kali😂 malu geh mb sesama perempuan,2 bulan yang lalu,1,False,2025-12-20T09:26:28.314548+00:00,wkwkw jangan jangan keluarganya si pelakor kali malu geh mb sesama perempuan,negatif
youtube,2BIwPUhZPS4,https://www.youtube.com/watch?v=2BIwPUhZPS4,"“SEMOGA BUR*NGMU GA BERDIRI LAGI!"" SUMPAH SEORANG ISTRI YG TERDZOLIMI !",UgzSqI-BURADwwCQFh14AaABAg.ANSz1PTnLvPANTOsedmP-m,@mpok_mochika,Sepertjnya anda bagian dri pelakor kayaknya😂,2 bulan yang lalu,1,False,2025-12-20T09:26:28.601129+00:00,sepertjnya anda bagian dri pelakor kayaknya,negatif
youtube,2BIwPUhZPS4,https://www.youtube.com/watch?v=2BIwPUhZPS4,"“SEMOGA BUR*NGMU GA BERDIRI LAGI!"" SUMPAH SEORANG ISTRI YG TERDZOLIMI !",UgzSqI-BURADwwCQFh14AaABAg.ANSz1PTnLvPANTPtMzXHha,@daus0465,"Ini selingkuhannya ni we,tangkap tangkap,buang yang jauh",2 bulan yang lalu,1,False,2025-12-20T09:26:29.574731+00:00,ini selingkuhannya ni we tangkap tangkap buang yang jauh,negatif
youtube,2BIwPUhZPS4,https://www.youtube.com/watch?v=2BIwPUhZPS4,"“SEMOGA BUR*NGMU GA BERDIRI LAGI!"" SUMPAH SEORANG ISTRI YG TERDZOLIMI !",UgzSqI-BURADwwCQFh14AaABAg.ANSz1PTnLvPANTQUb9qjF9,@Haituna,Ini akun emak nya si pelakor apa gimana maaf nanya dengan nada lembut kayak tisu,2 bulan yang lalu,1,False,2025-12-20T09:26:29.918992+00:00,ini akun emak nya si pelakor apa gimana maaf nanya dengan nada lembut kayak tisu,negatif
youtube,2BIwPUhZPS4,https://www.youtube.com/watch?v=2BIwPUhZPS4,"“SEMOGA BUR*NGMU GA BERDIRI LAGI!"" SUMPAH SEORANG ISTRI YG TERDZOLIMI !",UgzSqI-BURADwwCQFh14AaABAg.ANSz1PTnLvPANTRZMDalf6,@ratihal-rahman5578,Kayanya dia kesindir ga si? Atau ini akun fake si pelakor tersebut,2 bulan yang lalu,1,False,2025-12-20T09:26:30.814325+00:00,kayanya dia kesindir ga si atau ini akun fake si pelakor tersebut,negatif
youtube,2BIwPUhZPS4,https://www.youtube.com/watch?v=2BIwPUhZPS4,"“SEMOGA BUR*NGMU GA BERDIRI LAGI!"" SUMPAH SEORANG ISTRI YG TERDZOLIMI !",UgzSqI-BURADwwCQFh14AaABAg.ANSz1PTnLvPANTSvvcQ64k,@nikitahilman9609,Tentu saja perlu bs jd pembelajaran  biar mreka2 yg blm menikah bs lbh hati2 n bs berpikir kmbli jika sblm nikah sdh ada indikasi selingkuh utk tdk mlnjutkn lagi hub nya knjenjang pernikahan.,2 bulan yang lalu,1,False,2025-12-20T09:26:31.742194+00:00,tentu saja perlu bs jd pembelajaran biar mreka2 yg blm menikah bs lbh hati2 n bs berpikir kmbli jika sblm nikah sdh ada indikasi selingkuh utk tdk mlnjutkn lagi hub nya knjenjang pernikahan,negatif
youtube,2BIwPUhZPS4,https://www.youtube.com/watch?v=2BIwPUhZPS4,"“SEMOGA BUR*NGMU GA BERDIRI LAGI!"" SUMPAH SEORANG ISTRI YG TERDZOLIMI !",UgzSqI-BURADwwCQFh14AaABAg.ANSz1PTnLvPANTaOI4eEhS,@FauzanFauzana-s3l,Tim pelakor ya,2 bulan yang lalu,1,False,2025-12-20T09:26:32.108409+00:00,tim pelakor ya,negatif
youtube,2BIwPUhZPS4,https://www.youtube.com/watch?v=2BIwPUhZPS4,"“SEMOGA BUR*NGMU GA BERDIRI LAGI!"" SUMPAH SEORANG ISTRI YG TERDZOLIMI !",UgzSqI-BURADwwCQFh14AaABAg.ANSz1PTnLvPANTaYd2UIx1,@SelvyYanti-x6y,Emng ngapaa jngn jngn lu pihak pelakor.wk,2 bulan yang lalu,1,False,2025-12-20T09:26:32.394280+00:00,emng ngapaa jngn jngn lu pihak pelakor wk,negatif
youtube,2BIwPUhZPS4,https://www.youtube.com/watch?v=2BIwPUhZPS4,"“SEMOGA BUR*NGMU GA BERDIRI LAGI!"" SUMPAH SEORANG ISTRI YG TERDZOLIMI !",UgzSqI-BURADwwCQFh14AaABAg.ANSz1PTnLvPANTbo0C_a_f,@alwiwahyudi,Jangan2 pelakor nya ini,2 bulan yang lalu,1,False,2025-12-20T09:26:33.312419+00:00,jangan2 pelakor nya ini,negatif
youtube,2BIwPUhZPS4,https://www.youtube.com/watch?v=2BIwPUhZPS4,"“SEMOGA BUR*NGMU GA BERDIRI LAGI!"" SUMPAH SEORANG ISTRI YG TERDZOLIMI !",UgzSqI-BURADwwCQFh14AaABAg.ANSz1PTnLvPANTprI7e9WE,@elinasari-y3q,pasti ini suami yg selingkuh ituu😂😂,2 bulan yang lalu,1,False,2025-12-20T09:26:33.587282+00:00,pasti ini suami yg selingkuh ituu,negatif
youtube,2BIwPUhZPS4,https://www.youtube.com/watch?v=2BIwPUhZPS4,"“SEMOGA BUR*NGMU GA BERDIRI LAGI!"" SUMPAH SEORANG ISTRI YG TERDZOLIMI !",UgzSqI-BURADwwCQFh14AaABAg.ANSz1PTnLvPANTy9zhmbU-,@yoelluke998,Salah satu selingkuhannya kali dia 😂,2 bulan yang lalu,1,False,2025-12-20T09:26:33.920262+00:00,salah satu selingkuhannya kali dia,negatif
youtube,2BIwPUhZPS4,https://www.youtube.com/watch?v=2BIwPUhZPS4,"“SEMOGA BUR*NGMU GA BERDIRI LAGI!"" SUMPAH SEORANG ISTRI YG TERDZOLIMI !",UgzSqI-BURADwwCQFh14AaABAg.ANSz1PTnLvPANTzEJ4Rs1x,@rizalbozzki4181,"Lebih Parah Cerita Rumah Tangga Saya....Mantan Istri saya selingkuh sampe 5 tahun lebih tanpa ketahuan,baru ketahuan sicowok minta istri saya kerumah saya.",2 bulan yang lalu,1,False,2025-12-20T09:26:34.219437+00:00,lebih parah cerita rumah tangga saya mantan istri saya selingkuh sampe 5 tahun lebih tanpa ketahuan baru ketahuan sicowok minta istri saya kerumah saya,negatif
youtube,2BIwPUhZPS4,https://www.youtube.com/watch?v=2BIwPUhZPS4,"“SEMOGA BUR*NGMU GA BERDIRI LAGI!"" SUMPAH SEORANG ISTRI YG TERDZOLIMI !",UgzSqI-BURADwwCQFh14AaABAg.ANSz1PTnLvPANT8kjGQ7JA,@IreneNiiiaaa,"YA PENTING LAH T0L0L, SEMISAL KAU DISELINGKUHIN SUAMIMU PUN JUGA BISA CURHAT DI PODCAST BANG DENSU INI PAHAM YAH T0L0L... 😅😅😅",2 bulan yang lalu,0,False,2025-12-20T09:26:35.151405+00:00,ya penting lah t0l0l semisal kau diselingkuhin suamimu pun juga bisa curhat di podcast bang densu ini paham yah t0l0l,negatif
youtube,2BIwPUhZPS4,https://www.youtube.com/watch?v=2BIwPUhZPS4,"“SEMOGA BUR*NGMU GA BERDIRI LAGI!"" SUMPAH SEORANG ISTRI YG TERDZOLIMI !",UgzSqI-BURADwwCQFh14AaABAg.ANSz1PTnLvPANTA-3CY9u4,@ditamelani2091,Curiga ini akun pelakor pake fakee account,2 bulan yang lalu,0,False,2025-12-20T09:26:36.163706+00:00,curiga ini akun pelakor pake fakee account,negatif
youtube,2BIwPUhZPS4,https://www.youtube.com/watch?v=2BIwPUhZPS4,"“SEMOGA BUR*NGMU GA BERDIRI LAGI!"" SUMPAH SEORANG ISTRI YG TERDZOLIMI !",UgzSqI-BURADwwCQFh14AaABAg.ANSz1PTnLvPANTAu6wek2G,@megayulitakusrianti9515,Pentinggg dong anj. Kamu keluarga nya yah si pelakor syariah ini hufff,2 bulan yang lalu,0,False,2025-12-20T09:26:36.446223+00:00,pentinggg dong anj kamu keluarga nya yah si pelakor syariah ini hufff,negatif
youtube,2BIwPUhZPS4,https://www.youtube.com/watch?v=2BIwPUhZPS4,"“SEMOGA BUR*NGMU GA BERDIRI LAGI!"" SUMPAH SEORANG ISTRI YG TERDZOLIMI !",UgzSqI-BURADwwCQFh14AaABAg.ANSz1PTnLvPANTBRuu8GT0,@GHANYGarden,Pasti sesama pelakor atau saudaranya pelakor nih😂,2 bulan yang lalu,0,False,2025-12-20T09:26:36.736030+00:00,pasti sesama pelakor atau saudaranya pelakor nih,negatif
youtube,2BIwPUhZPS4,https://www.youtube.com/watch?v=2BIwPUhZPS4,"“SEMOGA BUR*NGMU GA BERDIRI LAGI!"" SUMPAH SEORANG ISTRI YG TERDZOLIMI !",UgzSqI-BURADwwCQFh14AaABAg.ANSz1PTnLvPANTCHaRwDj0,@komalakokom6858,Jgn pernah balik lg ma aldy ya..selingkuh itu penyakit..ga akan pernh sembuh..biar sama pelakor..biar d8a merasakan hal yg sa dgn  mu..kuat..bangkit..,2 bulan yang lalu,0,False,2025-12-20T09:26:37.631874+00:00,jgn pernah balik lg ma aldy ya selingkuh itu penyakit ga akan pernh sembuh biar sama pelakor biar d8a merasakan hal yg sa dgn mu kuat bangkit,negatif
youtube,2BIwPUhZPS4,https://www.youtube.com/watch?v=2BIwPUhZPS4,"“SEMOGA BUR*NGMU GA BERDIRI LAGI!"" SUMPAH SEORANG ISTRI YG TERDZOLIMI !",UgzSqI-BURADwwCQFh14AaABAg.ANSz1PTnLvPANTClh1x7vp,@anitamutiara2452,pelakornya tuh yg komen😁,2 bulan yang lalu,0,False,2025-12-20T09:26:37.910744+00:00,pelakornya tuh yg komen,negatif
youtube,2BIwPUhZPS4,https://www.youtube.com/watch?v=2BIwPUhZPS4,"“SEMOGA BUR*NGMU GA BERDIRI LAGI!"" SUMPAH SEORANG ISTRI YG TERDZOLIMI !",UgzSqI-BURADwwCQFh14AaABAg.ANSz1PTnLvPANTJTmYiosP,@spillyuli,"lu pelakor ya , jd gerah liat podcast beginian di tampilin ke publik berasa sakit ati kan kaum lu sesama pelakor dipermalukan wkowkowkowko",2 bulan yang lalu,0,False,2025-12-20T09:26:39.628003+00:00,lu pelakor ya jd gerah liat podcast beginian di tampilin ke publik berasa sakit ati kan kaum lu sesama pelakor dipermalukan wkowkowkowko,negatif
youtube,2BIwPUhZPS4,https://www.youtube.com/watch?v=2BIwPUhZPS4,"“SEMOGA BUR*NGMU GA BERDIRI LAGI!"" SUMPAH SEORANG ISTRI YG TERDZOLIMI !",UgzSqI-BURADwwCQFh14AaABAg.ANSz1PTnLvPANTKIf1Wz8T,@woellanshopsurabaya8510,"Perempuan bodoh dr awal pacaran penting di buat podcast biar gk ada yg bodoh lg kyk dia
Uda bodoh dr awal bucin parah knp baru skrg merasa tersakiti pdhl dr awal suaminy gk cinta dan selingkuh berkli2

ingat jgn contoh perempuan bodoh ini 
Jgn bucin hrs smart dan logika dipakai

Ini sdh bodoh bucin skrg merasa terdzolimi",2 bulan yang lalu,0,False,2025-12-20T09:26:40.544710+00:00,perempuan bodoh dr awal pacaran penting di buat podcast biar gk ada yg bodoh lg kyk dia uda bodoh dr awal bucin parah knp baru skrg merasa tersakiti pdhl dr awal suaminy gk cinta dan selingkuh berkli2 ingat jgn contoh perempuan bodoh ini jgn bucin hrs smart dan logika dipakai ini sdh bodoh bucin skrg merasa terdzolimi,negatif
youtube,2BIwPUhZPS4,https://www.youtube.com/watch?v=2BIwPUhZPS4,"“SEMOGA BUR*NGMU GA BERDIRI LAGI!"" SUMPAH SEORANG ISTRI YG TERDZOLIMI !",UgzSqI-BURADwwCQFh14AaABAg.ANSz1PTnLvPANTPPKpx5mo,@fajri-27,Keluarga pelakor lu?,2 bulan yang lalu,0,False,2025-12-20T09:26:40.925902+00:00,keluarga pelakor lu,negatif
youtube,2BIwPUhZPS4,https://www.youtube.com/watch?v=2BIwPUhZPS4,"“SEMOGA BUR*NGMU GA BERDIRI LAGI!"" SUMPAH SEORANG ISTRI YG TERDZOLIMI !",UgzSqI-BURADwwCQFh14AaABAg.ANSz1PTnLvPANTPiR8EymE,@altafandratv7024,"Orang tolol komen semaunya!!!Anda pelakor???
Buat bahan pembelajaran anji....k
Ambil positifnya!!!!",2 bulan yang lalu,0,False,2025-12-20T09:26:41.203875+00:00,orang tolol komen semaunya anda pelakor buat bahan pembelajaran anji k ambil positifnya,negatif
youtube,2BIwPUhZPS4,https://www.youtube.com/watch?v=2BIwPUhZPS4,"“SEMOGA BUR*NGMU GA BERDIRI LAGI!"" SUMPAH SEORANG ISTRI YG TERDZOLIMI !",UgzSqI-BURADwwCQFh14AaABAg.ANSz1PTnLvPANTTIzbX50a,@luka123marj,"Semoga lu tersakiti saat diselingkuhin, meski simpanan orang.",2 bulan yang lalu (diedit),0,False,2025-12-20T09:26:42.058248+00:00,semoga lu tersakiti saat diselingkuhin meski simpanan orang,negatif
youtube,2BIwPUhZPS4,https://www.youtube.com/watch?v=2BIwPUhZPS4,"“SEMOGA BUR*NGMU GA BERDIRI LAGI!"" SUMPAH SEORANG ISTRI YG TERDZOLIMI !",UgzSqI-BURADwwCQFh14AaABAg.ANSz1PTnLvPANTVgqMJBsL,@laila7152,PASTI PELAKOR NI😅😅😅,2 bulan yang lalu,0,False,2025-12-20T09:26:43.004068+00:00,pasti pelakor ni,negatif
youtube,2BIwPUhZPS4,https://www.youtube.com/watch?v=2BIwPUhZPS4,"“SEMOGA BUR*NGMU GA BERDIRI LAGI!"" SUMPAH SEORANG ISTRI YG TERDZOLIMI !",UgzSqI-BURADwwCQFh14AaABAg.ANSz1PTnLvPANTVwXxRBMo,@surysuryani1229,Sodaranya pelakor ya,2 bulan yang lalu,0,False,2025-12-20T09:26:43.278104+00:00,sodaranya pelakor ya,negatif
youtube,2BIwPUhZPS4,https://www.youtube.com/watch?v=2BIwPUhZPS4,"“SEMOGA BUR*NGMU GA BERDIRI LAGI!"" SUMPAH SEORANG ISTRI YG TERDZOLIMI !",UgzSqI-BURADwwCQFh14AaABAg.ANSz1PTnLvPANTXVnAM-IV,@Mitaa09,Ini pelakornya yaa ? Ataugak kamu sejenis pelakor itu,2 bulan yang lalu,0,False,2025-12-20T09:26:44.198338+00:00,ini pelakornya yaa ataugak kamu sejenis pelakor itu,negatif
youtube,2BIwPUhZPS4,https://www.youtube.com/watch?v=2BIwPUhZPS4,"“SEMOGA BUR*NGMU GA BERDIRI LAGI!"" SUMPAH SEORANG ISTRI YG TERDZOLIMI !",UgzSqI-BURADwwCQFh14AaABAg.ANSz1PTnLvPANTXwV7szAr,@owengode1359,"Perlu dong.....biar jd worning untuk para pasangan yg ingin berselingkuh,untuk mikir 2kali",2 bulan yang lalu,0,False,2025-12-20T09:26:44.528454+00:00,perlu dong biar jd worning untuk para pasangan yg ingin berselingkuh untuk mikir 2kali,negatif
