platform,video_id,video_url,video_title,comment_id,author,text,time,votes,heart,fetched_utc,text_clean,sentimen_rule
youtube,2BIwPUhZPS4,https://www.youtube.com/watch?v=2BIwPUhZPS4,"“SEMOGA BUR*NGMU GA BERDIRI LAGI!"" SUMPAH SEORANG ISTRI YG TERDZOLIMI !",UgzSqI-BURADwwCQFh14AaABAg.ANSz1PTnLvPANTz3D70xG8,@amyganes,"penting, apalagi untuk yang pernah mengalami tau rasanya udah pasti WAJIB meluapkan perasaan, sambil sentil para pelakor sialan, semoga kamu ga ngalamin deh yyyyaaaa",2 bulan yang lalu (diedit),0,False,2025-12-20T09:27:52.815563+00:00,penting apalagi untuk yang pernah mengalami tau rasanya udah pasti wajib meluapkan perasaan sambil sentil para pelakor sialan semoga kamu ga ngalamin deh yyyyaaaa,negatif
youtube,2BIwPUhZPS4,https://www.youtube.com/watch?v=2BIwPUhZPS4,"“SEMOGA BUR*NGMU GA BERDIRI LAGI!"" SUMPAH SEORANG ISTRI YG TERDZOLIMI !",UgzSqI-BURADwwCQFh14AaABAg.ANSz1PTnLvPANTzKlLSjoP,@shilvanaputry7927,Model pelaku selingkuh kyaknya dua 😂,2 bulan yang lalu,0,False,2025-12-20T09:27:53.718788+00:00,model pelaku selingkuh kyaknya dua,negatif
youtube,2BIwPUhZPS4,https://www.youtube.com/watch?v=2BIwPUhZPS4,"“SEMOGA BUR*NGMU GA BERDIRI LAGI!"" SUMPAH SEORANG ISTRI YG TERDZOLIMI !",UgzSqI-BURADwwCQFh14AaABAg.ANSz1PTnLvPANTzScbVTj8,@danilAprian,pasti yang komen keluarga selingkuhan nya😂,2 bulan yang lalu,0,False,2025-12-20T09:27:54.011673+00:00,pasti yang komen keluarga selingkuhan nya,negatif
youtube,2BIwPUhZPS4,https://www.youtube.com/watch?v=2BIwPUhZPS4,"“SEMOGA BUR*NGMU GA BERDIRI LAGI!"" SUMPAH SEORANG ISTRI YG TERDZOLIMI !",UgzSqI-BURADwwCQFh14AaABAg.ANSz1PTnLvPANTzVbdQteu,@KartiniTini-p8j,Biasanya klo kaya gini dia juga pelakor😂,2 bulan yang lalu,0,False,2025-12-20T09:27:54.283415+00:00,biasanya klo kaya gini dia juga pelakor,negatif
youtube,2BIwPUhZPS4,https://www.youtube.com/watch?v=2BIwPUhZPS4,"“SEMOGA BUR*NGMU GA BERDIRI LAGI!"" SUMPAH SEORANG ISTRI YG TERDZOLIMI !",UgzSqI-BURADwwCQFh14AaABAg.ANSz1PTnLvPANTzfz5pPjQ,@feniwulan8314,"kamu cantik,kamu berhak bahagia.. untuk feni2 di luar sana tolong kalo suami /pacar udah pernah selingkuh jangan terusin lagi",2 bulan yang lalu,0,False,2025-12-20T09:27:54.552169+00:00,kamu cantik kamu berhak bahagia untuk feni2 di luar sana tolong kalo suami pacar udah pernah selingkuh jangan terusin lagi,negatif
youtube,2BIwPUhZPS4,https://www.youtube.com/watch?v=2BIwPUhZPS4,"“SEMOGA BUR*NGMU GA BERDIRI LAGI!"" SUMPAH SEORANG ISTRI YG TERDZOLIMI !",UgzSqI-BURADwwCQFh14AaABAg.ANSz1PTnLvPANTzgomJQNf,@ZayanmalikAhmad,Kyanya ini keluarga si pelakor 😂,2 bulan yang lalu,0,False,2025-12-20T09:27:55.434648+00:00,kyanya ini keluarga si pelakor,negatif
youtube,2BIwPUhZPS4,https://www.youtube.com/watch?v=2BIwPUhZPS4,"“SEMOGA BUR*NGMU GA BERDIRI LAGI!"" SUMPAH SEORANG ISTRI YG TERDZOLIMI !",UgzSqI-BURADwwCQFh14AaABAg.ANSz1PTnLvPANU-MpyJ3RG,@EliyaSeli-dt6vu,"Biar perempuan tahu ciri ciri suami selingkuh,dengan adanya podcast ini secara nggak langsung oh seperti itu y klu pasangan kita Selingkuh",2 bulan yang lalu,0,False,2025-12-20T09:27:56.469648+00:00,biar perempuan tahu ciri ciri suami selingkuh dengan adanya podcast ini secara nggak langsung oh seperti itu y klu pasangan kita selingkuh,negatif
youtube,2BIwPUhZPS4,https://www.youtube.com/watch?v=2BIwPUhZPS4,"“SEMOGA BUR*NGMU GA BERDIRI LAGI!"" SUMPAH SEORANG ISTRI YG TERDZOLIMI !",UgzSqI-BURADwwCQFh14AaABAg.ANSz1PTnLvPANU-Nj9mZVF,@aisyahelwa9966,Pelakor lu ya? Atau seorang suami yang tukang selingkuh juga hahaha,2 bulan yang lalu,0,False,2025-12-20T09:27:56.746680+00:00,pelakor lu ya atau seorang suami yang tukang selingkuh juga hahaha,negatif
youtube,2BIwPUhZPS4,https://www.youtube.com/watch?v=2BIwPUhZPS4,"“SEMOGA BUR*NGMU GA BERDIRI LAGI!"" SUMPAH SEORANG ISTRI YG TERDZOLIMI !",UgzSqI-BURADwwCQFh14AaABAg.ANSz1PTnLvPANU-oBRgA9a,@fatonah4039,Jangan jangan pihak dr selingkuh an ya 😂,2 bulan yang lalu,0,False,2025-12-20T09:27:58.233893+00:00,jangan jangan pihak dr selingkuh an ya,negatif
youtube,2BIwPUhZPS4,https://www.youtube.com/watch?v=2BIwPUhZPS4,"“SEMOGA BUR*NGMU GA BERDIRI LAGI!"" SUMPAH SEORANG ISTRI YG TERDZOLIMI !",UgzSqI-BURADwwCQFh14AaABAg.ANSz1PTnLvPANU06JHHCgE,@putrinurcahya5032,Mungkin kamu salah satu selingkuhan nya ya 🧐,2 bulan yang lalu,0,False,2025-12-20T09:27:58.550218+00:00,mungkin kamu salah satu selingkuhan nya ya,negatif
youtube,2BIwPUhZPS4,https://www.youtube.com/watch?v=2BIwPUhZPS4,"“SEMOGA BUR*NGMU GA BERDIRI LAGI!"" SUMPAH SEORANG ISTRI YG TERDZOLIMI !",UgzSqI-BURADwwCQFh14AaABAg.ANSz1PTnLvPANU0E6LJOOd,@aduelsunset4237,Kayanyah nih manusia tim laki² yang doyan selingkuh jadi diah ngerasa kesinggung,2 bulan yang lalu,0,False,2025-12-20T09:27:59.446513+00:00,kayanyah nih manusia tim laki yang doyan selingkuh jadi diah ngerasa kesinggung,negatif
youtube,2BIwPUhZPS4,https://www.youtube.com/watch?v=2BIwPUhZPS4,"“SEMOGA BUR*NGMU GA BERDIRI LAGI!"" SUMPAH SEORANG ISTRI YG TERDZOLIMI !",UgzSqI-BURADwwCQFh14AaABAg.ANSz1PTnLvPANU0MHFnSmr,@JejakHarianku-y8s,Keluarga pelakor mungkin,2 bulan yang lalu,0,False,2025-12-20T09:28:00.391844+00:00,keluarga pelakor mungkin,negatif
youtube,2BIwPUhZPS4,https://www.youtube.com/watch?v=2BIwPUhZPS4,"“SEMOGA BUR*NGMU GA BERDIRI LAGI!"" SUMPAH SEORANG ISTRI YG TERDZOLIMI !",UgzSqI-BURADwwCQFh14AaABAg.ANSz1PTnLvPANU0X1meBHn,@diyahayuningrum7703,"Penting banget karna gw nunggu podcast perselingkuhan kakak ini di up 
Tapi Alhamdulillah di up kak densus 
Bisa jadi pembelajaran bagi suami yg buta kalau udah ada anak2",2 bulan yang lalu,0,False,2025-12-20T09:28:00.721938+00:00,penting banget karna gw nunggu podcast perselingkuhan kakak ini di up tapi alhamdulillah di up kak densus bisa jadi pembelajaran bagi suami yg buta kalau udah ada anak2,negatif
youtube,2BIwPUhZPS4,https://www.youtube.com/watch?v=2BIwPUhZPS4,"“SEMOGA BUR*NGMU GA BERDIRI LAGI!"" SUMPAH SEORANG ISTRI YG TERDZOLIMI !",UgzSqI-BURADwwCQFh14AaABAg.ANSz1PTnLvPANU0XOtUKRa,@riditiara3595,LO GA NGERASAIN JADI KORBAN SUAMI D REBUT PELAKOR jd bisa ngetik bgtu,2 bulan yang lalu,0,False,2025-12-20T09:28:01.556600+00:00,lo ga ngerasain jadi korban suami d rebut pelakor jd bisa ngetik bgtu,negatif
youtube,2BIwPUhZPS4,https://www.youtube.com/watch?v=2BIwPUhZPS4,"“SEMOGA BUR*NGMU GA BERDIRI LAGI!"" SUMPAH SEORANG ISTRI YG TERDZOLIMI !",UgzSqI-BURADwwCQFh14AaABAg.ANSz1PTnLvPANU0Zj3LKPd,@rwa3128,Jangan jangan akun si pelakor atau orang tua si pelakor atau saudara si pelakor 🤣,2 bulan yang lalu,0,False,2025-12-20T09:28:01.843714+00:00,jangan jangan akun si pelakor atau orang tua si pelakor atau saudara si pelakor,negatif
youtube,2BIwPUhZPS4,https://www.youtube.com/watch?v=2BIwPUhZPS4,"“SEMOGA BUR*NGMU GA BERDIRI LAGI!"" SUMPAH SEORANG ISTRI YG TERDZOLIMI !",UgzSqI-BURADwwCQFh14AaABAg.ANSz1PTnLvPANU0dqSG238,@intanresapratiwi6319,Team pelakor neh kayaknya😂😂,2 bulan yang lalu,0,False,2025-12-20T09:28:02.136527+00:00,team pelakor neh kayaknya,negatif
youtube,2BIwPUhZPS4,https://www.youtube.com/watch?v=2BIwPUhZPS4,"“SEMOGA BUR*NGMU GA BERDIRI LAGI!"" SUMPAH SEORANG ISTRI YG TERDZOLIMI !",UgzSqI-BURADwwCQFh14AaABAg.ANSz1PTnLvPANU0fsoK3UB,@sesadwidianameicaesar9947,"ceritanya sama dengan rumah tangga ku di masa lalu,bahkan aku tau suamiku selingkuh hanya dari perantara doa yang ku panjatkan hanya dalam hati setelah sholat (jika suamiku selingkuh maka  🐦 nya tidak bisa bangun) dan itu terjadi,sempet masih gak percaya, sampai keluar pengakuan dari mulut suamiku sendiri yang sekarang sudah jadi mantan, alkhamdulilah sekarang aku sudah mendapatkan pengganti yang menerima aku dan anak anakku apa adanya,mertua yang sayang,aku percaya Allah akan mengangkat derajatmu de dan mendapatkan ganti yang lebih baik amiin",2 bulan yang lalu,0,False,2025-12-20T09:28:02.427147+00:00,ceritanya sama dengan rumah tangga ku di masa lalu bahkan aku tau suamiku selingkuh hanya dari perantara doa yang ku panjatkan hanya dalam hati setelah sholat jika suamiku selingkuh maka nya tidak bisa bangun dan itu terjadi sempet masih gak percaya sampai keluar pengakuan dari mulut suamiku sendiri yang sekarang sudah jadi mantan alkhamdulilah sekarang aku sudah mendapatkan pengganti yang menerima aku dan anak anakku apa adanya mertua yang sayang aku percaya allah akan mengangkat derajatmu de dan mendapatkan ganti yang lebih baik amiin,negatif
youtube,2BIwPUhZPS4,https://www.youtube.com/watch?v=2BIwPUhZPS4,"“SEMOGA BUR*NGMU GA BERDIRI LAGI!"" SUMPAH SEORANG ISTRI YG TERDZOLIMI !",UgzSqI-BURADwwCQFh14AaABAg.ANSz1PTnLvPANU0jWw_gJg,@dichaprabowoedykurniawan8575,sodara si pelakor ya,2 bulan yang lalu,0,False,2025-12-20T09:28:02.693858+00:00,sodara si pelakor ya,negatif
youtube,2BIwPUhZPS4,https://www.youtube.com/watch?v=2BIwPUhZPS4,"“SEMOGA BUR*NGMU GA BERDIRI LAGI!"" SUMPAH SEORANG ISTRI YG TERDZOLIMI !",UgzSqI-BURADwwCQFh14AaABAg.ANSz1PTnLvPANU0sPaJ83w,@nooryanchannel7257,"Penting,biar perempuan kyk km mikir jg klu mau jd pelakor",2 bulan yang lalu,0,False,2025-12-20T09:28:03.532007+00:00,penting biar perempuan kyk km mikir jg klu mau jd pelakor,negatif
youtube,2BIwPUhZPS4,https://www.youtube.com/watch?v=2BIwPUhZPS4,"“SEMOGA BUR*NGMU GA BERDIRI LAGI!"" SUMPAH SEORANG ISTRI YG TERDZOLIMI !",UgzSqI-BURADwwCQFh14AaABAg.ANSz1PTnLvPANU134HZMS5,@Yahuuiii,Kamu sodaranya pelakor kah? Wkwkwk,2 bulan yang lalu,0,False,2025-12-20T09:28:04.400254+00:00,kamu sodaranya pelakor kah wkwkwk,negatif
youtube,2BIwPUhZPS4,https://www.youtube.com/watch?v=2BIwPUhZPS4,"“SEMOGA BUR*NGMU GA BERDIRI LAGI!"" SUMPAH SEORANG ISTRI YG TERDZOLIMI !",UgzSqI-BURADwwCQFh14AaABAg.ANSz1PTnLvPANU1EICJtFe,@Badut_pelampiasan,KAMU PASTI PELAKOR Y,2 bulan yang lalu,0,False,2025-12-20T09:28:04.692145+00:00,kamu pasti pelakor y,negatif
youtube,2BIwPUhZPS4,https://www.youtube.com/watch?v=2BIwPUhZPS4,"“SEMOGA BUR*NGMU GA BERDIRI LAGI!"" SUMPAH SEORANG ISTRI YG TERDZOLIMI !",UgzSqI-BURADwwCQFh14AaABAg.ANSz1PTnLvPANU1GPCSBgr,@nurafliasafitri1501,Napa kau ? Bagian keluarga dari betina gatal si pelakor ya ? Wkwkwkwkwk,2 bulan yang lalu,0,False,2025-12-20T09:28:04.990929+00:00,napa kau bagian keluarga dari betina gatal si pelakor ya wkwkwkwkwk,negatif
youtube,2BIwPUhZPS4,https://www.youtube.com/watch?v=2BIwPUhZPS4,"“SEMOGA BUR*NGMU GA BERDIRI LAGI!"" SUMPAH SEORANG ISTRI YG TERDZOLIMI !",UgzSqI-BURADwwCQFh14AaABAg.ANSz1PTnLvPANU1JIeStR6,@Cencen-m9c,Km pelakor jga ya? Panasss yeee😂,2 bulan yang lalu,0,False,2025-12-20T09:28:05.261168+00:00,km pelakor jga ya panasss yeee,negatif
youtube,2BIwPUhZPS4,https://www.youtube.com/watch?v=2BIwPUhZPS4,"“SEMOGA BUR*NGMU GA BERDIRI LAGI!"" SUMPAH SEORANG ISTRI YG TERDZOLIMI !",UgzSqI-BURADwwCQFh14AaABAg.ANSz1PTnLvPANU1WN1SQOa,@Yuliantina75,Penting ndak penting sih emang ada masalah buat kamu? Apa kamu jg merasa jd seorang pelakor?,2 bulan yang lalu,0,False,2025-12-20T09:28:06.157234+00:00,penting ndak penting sih emang ada masalah buat kamu apa kamu jg merasa jd seorang pelakor,negatif
youtube,2BIwPUhZPS4,https://www.youtube.com/watch?v=2BIwPUhZPS4,"“SEMOGA BUR*NGMU GA BERDIRI LAGI!"" SUMPAH SEORANG ISTRI YG TERDZOLIMI !",UgzSqI-BURADwwCQFh14AaABAg.ANSz1PTnLvPANU1cAqI1Uc,@richiv6681,"Belajar KK,,, mempelajari gelagat orang selingkuh.....",2 bulan yang lalu,0,False,2025-12-20T09:28:07.022066+00:00,belajar kk mempelajari gelagat orang selingkuh,negatif
youtube,2BIwPUhZPS4,https://www.youtube.com/watch?v=2BIwPUhZPS4,"“SEMOGA BUR*NGMU GA BERDIRI LAGI!"" SUMPAH SEORANG ISTRI YG TERDZOLIMI !",UgzSqI-BURADwwCQFh14AaABAg.ANSz1PTnLvPANU1leA6Z8Y,@rahmanurhalimma,Keluarga dari pelakor mungkin ini 😅,2 bulan yang lalu,0,False,2025-12-20T09:28:07.323397+00:00,keluarga dari pelakor mungkin ini,negatif
youtube,2BIwPUhZPS4,https://www.youtube.com/watch?v=2BIwPUhZPS4,"“SEMOGA BUR*NGMU GA BERDIRI LAGI!"" SUMPAH SEORANG ISTRI YG TERDZOLIMI !",UgzSqI-BURADwwCQFh14AaABAg.ANSz1PTnLvPANU1ovnv1GS,@WiwikindrayaniWiwik,Jangan 2 anda pelakor nya 😂😂😂,2 bulan yang lalu,0,False,2025-12-20T09:28:07.582965+00:00,jangan 2 anda pelakor nya,negatif
youtube,2BIwPUhZPS4,https://www.youtube.com/watch?v=2BIwPUhZPS4,"“SEMOGA BUR*NGMU GA BERDIRI LAGI!"" SUMPAH SEORANG ISTRI YG TERDZOLIMI !",UgzSqI-BURADwwCQFh14AaABAg.ANSz1PTnLvPAOph3pdEhk0,@fatihhidayat7941,Anda pelakor nya ya 😅,1 bulan yang lalu,0,False,2025-12-20T09:28:08.509463+00:00,anda pelakor nya ya,negatif
youtube,2BIwPUhZPS4,https://www.youtube.com/watch?v=2BIwPUhZPS4,"“SEMOGA BUR*NGMU GA BERDIRI LAGI!"" SUMPAH SEORANG ISTRI YG TERDZOLIMI !",UgzSqI-BURADwwCQFh14AaABAg.ANSz1PTnLvPANTEO97KeVx,@hannysuhendar1495,"Jangan"" kmu tmn si pelakor 🤭",2 bulan yang lalu,1,False,2025-12-20T09:28:08.805278+00:00,jangan kmu tmn si pelakor,negatif
youtube,2BIwPUhZPS4,https://www.youtube.com/watch?v=2BIwPUhZPS4,"“SEMOGA BUR*NGMU GA BERDIRI LAGI!"" SUMPAH SEORANG ISTRI YG TERDZOLIMI !",UgzG9SGt-dnB5C-IlH14AaABAg,@putrisatria6243,Padahal mbak nya cantik sempurna tapi masih diselingkuhi apa kabar aku yg kayak pulu2 ini😢,10 hari yang lalu,0,False,2025-12-20T09:28:09.502050+00:00,padahal mbak nya cantik sempurna tapi masih diselingkuhi apa kabar aku yg kayak pulu2 ini,negatif
youtube,2BIwPUhZPS4,https://www.youtube.com/watch?v=2BIwPUhZPS4,"“SEMOGA BUR*NGMU GA BERDIRI LAGI!"" SUMPAH SEORANG ISTRI YG TERDZOLIMI !",UgyCHVx_8pc7Hf9nbuB4AaABAg,@nanamuchid769,Pelakor & Suami yg Selingkuh. berlindung di bawah nikah siri. pasti kena Laknat Allah. Gak akan Berkah Rezekinya,12 hari yang lalu,0,False,2025-12-20T09:28:09.783903+00:00,pelakor suami yg selingkuh berlindung di bawah nikah siri pasti kena laknat allah gak akan berkah rezekinya,negatif
youtube,2BIwPUhZPS4,https://www.youtube.com/watch?v=2BIwPUhZPS4,"“SEMOGA BUR*NGMU GA BERDIRI LAGI!"" SUMPAH SEORANG ISTRI YG TERDZOLIMI !",UgzbwsOTP8wTrMITgGV4AaABAg,@nuryahya06,"selingkuh itu sama kaya penyakit maag , kapan aja bisa kambuh...",3 minggu yang lalu,1,False,2025-12-20T09:28:10.092081+00:00,selingkuh itu sama kaya penyakit maag kapan aja bisa kambuh,negatif
youtube,2BIwPUhZPS4,https://www.youtube.com/watch?v=2BIwPUhZPS4,"“SEMOGA BUR*NGMU GA BERDIRI LAGI!"" SUMPAH SEORANG ISTRI YG TERDZOLIMI !",UgxsRBXGBtOcpZM3IpV4AaABAg,@ronaldi2246,"cewek cantik gini body bagus berhijab juga, malah di selingkuhin, udah punya anak jgA kasian.  kurang apa lgi coba",3 minggu yang lalu,1,False,2025-12-20T09:28:10.377216+00:00,cewek cantik gini body bagus berhijab juga malah di selingkuhin udah punya anak jga kasian kurang apa lgi coba,negatif
youtube,2BIwPUhZPS4,https://www.youtube.com/watch?v=2BIwPUhZPS4,"“SEMOGA BUR*NGMU GA BERDIRI LAGI!"" SUMPAH SEORANG ISTRI YG TERDZOLIMI !",UgwpPj78jDI0WfkG5ot4AaABAg,@rere_ngkolan9941,kenapa yg selingkuh kebanyakan yang  agamanya top markotop 😁,3 minggu yang lalu,0,False,2025-12-20T09:28:11.086059+00:00,kenapa yg selingkuh kebanyakan yang agamanya top markotop,negatif
youtube,2BIwPUhZPS4,https://www.youtube.com/watch?v=2BIwPUhZPS4,"“SEMOGA BUR*NGMU GA BERDIRI LAGI!"" SUMPAH SEORANG ISTRI YG TERDZOLIMI !",UgzqPffGVnFr_FI_Fpx4AaABAg,@verizalputrawijaya3560,Si pelakornya pake hijab dan selalu ikut acara keagamaan tapi berzina di luar nikah dengan suami orang. Emang udah gila! Ikut acara keagamaan bukan kebutuhan hati tapi kebutuhan status duniawi.,3 minggu yang lalu,0,False,2025-12-20T09:28:11.377755+00:00,si pelakornya pake hijab dan selalu ikut acara keagamaan tapi berzina di luar nikah dengan suami orang emang udah gila ikut acara keagamaan bukan kebutuhan hati tapi kebutuhan status duniawi,negatif
youtube,2BIwPUhZPS4,https://www.youtube.com/watch?v=2BIwPUhZPS4,"“SEMOGA BUR*NGMU GA BERDIRI LAGI!"" SUMPAH SEORANG ISTRI YG TERDZOLIMI !",UgxU55ymc3a6Q0nVrDJ4AaABAg,@ELputinruska,"Terima. Aja. Diselingkuhi belum dimaksiatin. Hadeuhhh, jaman now lelaki takut ama cewe terbalik udah",3 minggu yang lalu,0,False,2025-12-20T09:28:11.641965+00:00,terima aja diselingkuhi belum dimaksiatin hadeuhhh jaman now lelaki takut ama cewe terbalik udah,negatif
youtube,2BIwPUhZPS4,https://www.youtube.com/watch?v=2BIwPUhZPS4,"“SEMOGA BUR*NGMU GA BERDIRI LAGI!"" SUMPAH SEORANG ISTRI YG TERDZOLIMI !",Ugwt6spf9rTtgkkDx7Z4AaABAg,@AbiTiara-v7r,memang ya penyakit selingkuh itu gk bisa sembuh😢,4 minggu yang lalu,0,False,2025-12-20T09:28:11.935580+00:00,memang ya penyakit selingkuh itu gk bisa sembuh,negatif
youtube,2BIwPUhZPS4,https://www.youtube.com/watch?v=2BIwPUhZPS4,"“SEMOGA BUR*NGMU GA BERDIRI LAGI!"" SUMPAH SEORANG ISTRI YG TERDZOLIMI !",UgxXVzXgUbXWHirr8-B4AaABAg,@user-sf9rn9yx5f,selingkuh kau suami birahi teros,4 minggu yang lalu,0,False,2025-12-20T09:28:12.250094+00:00,selingkuh kau suami birahi teros,negatif
youtube,2BIwPUhZPS4,https://www.youtube.com/watch?v=2BIwPUhZPS4,"“SEMOGA BUR*NGMU GA BERDIRI LAGI!"" SUMPAH SEORANG ISTRI YG TERDZOLIMI !",UgxcW-bj75hvznaTtK54AaABAg,@raghaisprapdiko,kalo kodrat nya selingkuh .. sslamanya ..,4 minggu yang lalu,0,False,2025-12-20T09:28:12.929745+00:00,kalo kodrat nya selingkuh sslamanya,negatif
youtube,2BIwPUhZPS4,https://www.youtube.com/watch?v=2BIwPUhZPS4,"“SEMOGA BUR*NGMU GA BERDIRI LAGI!"" SUMPAH SEORANG ISTRI YG TERDZOLIMI !",Ugyfh949qE_6FYUcdKV4AaABAg,@arinikusmintarti4782,Orang kalau selingkuh yang tadinya kucing kucingan kemudian ketahuan istri atau keluarganya dia malah senang karena bisa berbuat dengan terang terangan,1 bulan yang lalu,0,False,2025-12-20T09:28:13.207744+00:00,orang kalau selingkuh yang tadinya kucing kucingan kemudian ketahuan istri atau keluarganya dia malah senang karena bisa berbuat dengan terang terangan,negatif
youtube,2BIwPUhZPS4,https://www.youtube.com/watch?v=2BIwPUhZPS4,"“SEMOGA BUR*NGMU GA BERDIRI LAGI!"" SUMPAH SEORANG ISTRI YG TERDZOLIMI !",UgxlDAV9shpRf6IEbRF4AaABAg,@arinikusmintarti4782,"Ooo memang bakat selingkuh.
Hampir semua laki kaki begitu",1 bulan yang lalu,0,False,2025-12-20T09:28:13.497802+00:00,ooo memang bakat selingkuh hampir semua laki kaki begitu,negatif
youtube,2BIwPUhZPS4,https://www.youtube.com/watch?v=2BIwPUhZPS4,"“SEMOGA BUR*NGMU GA BERDIRI LAGI!"" SUMPAH SEORANG ISTRI YG TERDZOLIMI !",UgwKGXsueR5mwkmhRi14AaABAg,@arinikusmintarti4782,"Aamiin
In sya Allah doamu terkabul.
Istri cantik diselingkuhi",1 bulan yang lalu,0,False,2025-12-20T09:28:13.772641+00:00,aamiin in sya allah doamu terkabul istri cantik diselingkuhi,negatif
youtube,2BIwPUhZPS4,https://www.youtube.com/watch?v=2BIwPUhZPS4,"“SEMOGA BUR*NGMU GA BERDIRI LAGI!"" SUMPAH SEORANG ISTRI YG TERDZOLIMI !",UgxxR5A1j2NJoychLnp4AaABAg,@EdaWina,Yg gak suka sama curhat istri sah pasti pelakor a.k.a lon*nte,1 bulan yang lalu,1,False,2025-12-20T09:28:14.785714+00:00,yg gak suka sama curhat istri sah pasti pelakor a k a lon nte,negatif
youtube,2BIwPUhZPS4,https://www.youtube.com/watch?v=2BIwPUhZPS4,"“SEMOGA BUR*NGMU GA BERDIRI LAGI!"" SUMPAH SEORANG ISTRI YG TERDZOLIMI !",Ugye8HLE97VKL4UxgDV4AaABAg,@MONTOON-z8s,"Padahal cantik, ga bersyukur ya udah selingkuh",1 bulan yang lalu,1,False,2025-12-20T09:28:15.065602+00:00,padahal cantik ga bersyukur ya udah selingkuh,negatif
youtube,2BIwPUhZPS4,https://www.youtube.com/watch?v=2BIwPUhZPS4,"“SEMOGA BUR*NGMU GA BERDIRI LAGI!"" SUMPAH SEORANG ISTRI YG TERDZOLIMI !",UgzpRdGsZf2ePw828dt4AaABAg,@kadankilank1251,"Jadi ada yg melaporkan suamiku selingkuh,trus aku langsung tanyain ke suamiki' mas kamu selingkuh?' Jawab suamiku ""nggaklah gila kamu nanyain begitu,dapat berita darimana kamu?"", dari si A,langsung aku sebutin nama orang yg nyampein,dan ekspresi wajahnya langsung berubah dia langsung pergi jumpain orang itu,nggak berapa lama dia balik,aku tanyain ke suamiku ,'kamu apakan orang itu',aku nanyain kedia apa maksud kamu ngomongin ke istri saya klw saya selingkuh,trus akh nggak mau dengar lagi penjelelasan suamiku aku biarkan suamiku capek sendiri ngurusin perselingkuhannya,dan anehnya dgn sikap tenangku itu alhamdulillah sampai sekarang 22 thn kami menikah suamiku itu baiknya beribu2 kali lipat dan  malah kesannya malah sepeeti takut aku tinggalkan",1 bulan yang lalu,1,False,2025-12-20T09:28:15.356575+00:00,jadi ada yg melaporkan suamiku selingkuh trus aku langsung tanyain ke suamiki mas kamu selingkuh jawab suamiku nggaklah gila kamu nanyain begitu dapat berita darimana kamu dari si a langsung aku sebutin nama orang yg nyampein dan ekspresi wajahnya langsung berubah dia langsung pergi jumpain orang itu nggak berapa lama dia balik aku tanyain ke suamiku kamu apakan orang itu aku nanyain kedia apa maksud kamu ngomongin ke istri saya klw saya selingkuh trus akh nggak mau dengar lagi penjelelasan suamiku aku biarkan suamiku capek sendiri ngurusin perselingkuhannya dan anehnya dgn sikap tenangku itu alhamdulillah sampai sekarang 22 thn kami menikah suamiku itu baiknya beribu2 kali lipat dan malah kesannya malah sepeeti takut aku tinggalkan,negatif
youtube,2BIwPUhZPS4,https://www.youtube.com/watch?v=2BIwPUhZPS4,"“SEMOGA BUR*NGMU GA BERDIRI LAGI!"" SUMPAH SEORANG ISTRI YG TERDZOLIMI !",UgyMdg9_LwEanxJTLjt4AaABAg,@safitrisafitri4658,"buat siapapun kalian yang baca pesan aku tolong banget bantu up kasus perselingkuhan suami dri teth aku, kasian anaknya masi pada kecil yang 1 smp yang stunya lgi umur 3,5 tahun dan sakit sakitan aja guys,harus selalu berobat pertumbuhannya kurang,suami tth aku selingkuh sama tetangga sendiri yang bahkan uda dianggap sodara sendiri,teteh aku pas tau tentang perselingkuhan ini langsung shock bahkan sempat ga sadarkan diri,kasian mental ank'nya guys,tolong banget bantu up guys kasusnya kasian, ayo bantu untuk kasus perselingkuhan seperti ini guys jangan perna dinormalisasikn,aku gatau harus minta tolong kesiapa lagi🥹🥹...",1 bulan yang lalu,0,False,2025-12-20T09:28:15.653478+00:00,buat siapapun kalian yang baca pesan aku tolong banget bantu up kasus perselingkuhan suami dri teth aku kasian anaknya masi pada kecil yang 1 smp yang stunya lgi umur 3 5 tahun dan sakit sakitan aja guys harus selalu berobat pertumbuhannya kurang suami tth aku selingkuh sama tetangga sendiri yang bahkan uda dianggap sodara sendiri teteh aku pas tau tentang perselingkuhan ini langsung shock bahkan sempat ga sadarkan diri kasian mental ank nya guys tolong banget bantu up guys kasusnya kasian ayo bantu untuk kasus perselingkuhan seperti ini guys jangan perna dinormalisasikn aku gatau harus minta tolong kesiapa lagi,negatif
youtube,2BIwPUhZPS4,https://www.youtube.com/watch?v=2BIwPUhZPS4,"“SEMOGA BUR*NGMU GA BERDIRI LAGI!"" SUMPAH SEORANG ISTRI YG TERDZOLIMI !",Ugz3q5giezkqpG9PWTl4AaABAg,@TejoTejo-i4n,"Memang pintar  mbak nya 
Ketahuan suami nya selingkuh 
 Luar biasa 👍 keren",1 bulan yang lalu,4,False,2025-12-20T09:28:15.952215+00:00,memang pintar mbak nya ketahuan suami nya selingkuh luar biasa keren,negatif
youtube,2BIwPUhZPS4,https://www.youtube.com/watch?v=2BIwPUhZPS4,"“SEMOGA BUR*NGMU GA BERDIRI LAGI!"" SUMPAH SEORANG ISTRI YG TERDZOLIMI !",Ugx0mm5mlohqSOvcoqZ4AaABAg,@SumarniPakaya,"Pengeeen sekali curhat seperti ini ke nak densu, walaupun kejadian ini pernah ku alami udah sekian lama, dari anak2 masih kecil2 blm sekolah, anakku ada 4 orang, 2 laki2 2perempuan, suami berselingkuh, anak2ku usianya hy berdekatan, sulung usia 8th,anak ke 2 & ke 3 , usia 3+th & 2+ ,sedangkan yg bungsu usia 8 bulan, aku ngurus anak2 dg baik,gada yg dekil2, bahkan tetangga2 sering bilang,anak2ku wangi2,ganteng2 & cantik. Bulan pertama ampe ke 3 aku stress banget,tapi anak2ku ga pernah kutelantarkan,walaupun suamiku waktu itu pergi tak kembali2.Endingnya skrg anak2ku udah pada menikah,py pekerjaan MAPAN, anak2ku ku sekolahkan ampe perguruan tinggi,walaupun aku tak punya harta & tak dibantu keluarga, hanya ADA ALLAH  tempatku mengadu, pengadianku dijawab dg kebaikan2, hingga anak2ku berakhlak baik &  berhasil .
Salam & doa terbaik untuk ibu2 yg didzolimi & tersakiti, Semoga diberikan hidayah ,jalan yg indah tanpa suami dalam membesarkan anak serta bisa hidup berkecukuoan dg bantuan Allah SWT, RidhoNya Allah, AamiinYaaRobbalAlaamiin🤲🤲🤲🤲🤲❤️",1 bulan yang lalu,0,False,2025-12-20T09:28:16.290038+00:00,pengeeen sekali curhat seperti ini ke nak densu walaupun kejadian ini pernah ku alami udah sekian lama dari anak2 masih kecil2 blm sekolah anakku ada 4 orang 2 laki2 2perempuan suami berselingkuh anak2ku usianya hy berdekatan sulung usia 8th anak ke 2 ke 3 usia 3 th 2 sedangkan yg bungsu usia 8 bulan aku ngurus anak2 dg baik gada yg dekil2 bahkan tetangga2 sering bilang anak2ku wangi2 ganteng2 cantik bulan pertama ampe ke 3 aku stress banget tapi anak2ku ga pernah kutelantarkan walaupun suamiku waktu itu pergi tak kembali2 endingnya skrg anak2ku udah pada menikah py pekerjaan mapan anak2ku ku sekolahkan ampe perguruan tinggi walaupun aku tak punya harta tak dibantu keluarga hanya ada allah tempatku mengadu pengadianku dijawab dg kebaikan2 hingga anak2ku berakhlak baik berhasil salam doa terbaik untuk ibu2 yg didzolimi tersakiti semoga diberikan hidayah jalan yg indah tanpa suami dalam membesarkan anak serta bisa hidup berkecukuoan dg bantuan allah swt ridhonya allah aamiinyaarobbalalaamiin,negatif
youtube,2BIwPUhZPS4,https://www.youtube.com/watch?v=2BIwPUhZPS4,"“SEMOGA BUR*NGMU GA BERDIRI LAGI!"" SUMPAH SEORANG ISTRI YG TERDZOLIMI !",UgyEL9AWxxBbg2OEgBV4AaABAg,@gaulnoval4625,Secantik ini masih di selingkuhin,1 bulan yang lalu,1,False,2025-12-20T09:28:16.557716+00:00,secantik ini masih di selingkuhin,negatif
youtube,2BIwPUhZPS4,https://www.youtube.com/watch?v=2BIwPUhZPS4,"“SEMOGA BUR*NGMU GA BERDIRI LAGI!"" SUMPAH SEORANG ISTRI YG TERDZOLIMI !",Ugyh7QI5Defu4ppE6U14AaABAg,@Herlina-u3g9i,"Sama seperti suamiku yg sekarang kelakuannya,,diminta cerai GK mau,,tp klo selingkuh masih terus dilanjut",1 bulan yang lalu,0,False,2025-12-20T09:28:16.839115+00:00,sama seperti suamiku yg sekarang kelakuannya diminta cerai gk mau tp klo selingkuh masih terus dilanjut,negatif
